Condition,Model,ReceivedDate,SerialNumber,StockStatus,SupplierName,Note.0,updated_at,oldModelName,newModelName
USEB,WS-C3560-48PS-S,1386954000,CAT1051ZKK3,0,39,Model Note:V04,2019-08-06T05:03:46.000Z,WS-C3560-48PS-S#WS-C3560-48PS-S ,WS-C3560-48PS-S
USEB,WS-C3560-48PS-S,1386954000,CAT1051ZKKA,0,39,Model Note:V04,2019-08-06T05:03:46.000Z,WS-C3560-48PS-S#WS-C3560-48PS-S ,WS-C3560-48PS-S
USEB,WS-C3560-48PS-S,1386954000,CAT1051NKQK,0,39,Model Note:V04,2019-08-06T05:03:46.000Z,WS-C3560-48PS-S#WS-C3560-48PS-S ,WS-C3560-48PS-S
USEB,WS-C3560-48PS-S,1386954000,CAT1051ZKKX,0,39,Model Note:V04,2019-08-06T05:03:46.000Z,WS-C3560-48PS-S#WS-C3560-48PS-S ,WS-C3560-48PS-S
USEB,WS-C3560-48PS-S,1386954000,CAT1051NKNQ,0,39,Model Note:V04,2019-08-06T05:03:46.000Z,WS-C3560-48PS-S#WS-C3560-48PS-S ,WS-C3560-48PS-S
USEC,WS-C3560-48PS-S,1386954000,FDO1213Y2U2,0,39,Side Damaged,2019-08-06T00:05:33.000Z,WS-C3560-48PS-S,WS-C3560-48PS-S
USEC,WS-C3560-48PS-S,1386954000,FDO1248X00C,0,39,Port Gi0/2 Damaged,2019-08-06T00:05:33.000Z,WS-C3560-48PS-S,WS-C3560-48PS-S
USEB,SFP-GE-Z,1386954000,SPC163009MH,0,39,"Antistatic Bag,
V01, WH",2019-08-06T00:05:42.000Z,SFP-GE-Z,SFP-GE-Z
USEA,CBS-DEL-X2-CX4#X2-10GB-CX4,1386954000,OSG12051722,0,39,"Antistatic bag broken, V03, WH",2019-08-06T00:37:03.000Z,CBS-DEL-X2-CX4#X2-10GB-CX4,CBS-DEL-X2-CX4
NOB,XENPAK-10GB-LR+=,1386954000,ONT1527010R,0,39,"V01, Bag broken",2019-08-06T00:05:42.000Z,XENPAK-10GB-LR+,XENPAK-10GB-LR+
USEB,XENPAK-10GB-LR,1386954000,INT0818M04F,0,39,"V01, Antistatic Bag",2019-08-06T00:05:42.000Z,XENPAK-10GB-LR,XENPAK-10GB-LR
USEB,XENPAK-10GB-CX4,1386954000,EMC09229073,0,39,"V01, Antistatic Bag",2019-08-06T00:05:42.000Z,XENPAK-10GB-CX4,XENPAK-10GB-CX4
USEB,GLC-GE-100FX=,1386954000,OPA15181239,0,39,"V01, Antistatic bag",2019-08-06T00:05:42.000Z,GLC-GE-100FX,GLC-GE-100FX
PART,GLC-GE-100FX=,1386954000,OPA15050502,1,39,"SMD.BOX.032; 02/12/2019
",2019-12-02T00:39:24.000Z,GLC-GE-100FX,GLC-GE-100FX
PART,GLC-GE-100FX=,1386954000,OPA12031755,0,39,"V01, Antistatic bag, broken part",2019-08-06T00:05:42.000Z,GLC-GE-100FX,GLC-GE-100FX
PART,GLC-GE-100FX=,1386954000,OPC10092213,0,39,"V01, Antistatic bag, broken part",2019-08-06T00:05:42.000Z,GLC-GE-100FX,GLC-GE-100FX
USEB,SFP-10G-LR,1386954000,FNS16120472,0,39,"v02, Antistatic, Need to retest before ship",2019-08-06T00:05:43.000Z,SFP-10G-LR,SFP-10G-LR
USEA,XFP-10G-MM-SR,1386954000,ONT151410UX,1,39,"V01,",2019-08-06T05:03:46.000Z,XFP-10G-MM-SR#XFP-10G-MM-SR ,XFP-10G-MM-SR
USEA,XFP-10G-MM-SR,1386954000,ONT151410UP,0,39,"V01,",2019-08-06T05:03:47.000Z,XFP-10G-MM-SR#XFP-10G-MM-SR ,XFP-10G-MM-SR
USEB,XFP-10GLR-OC192SR,1386954000,ONT1647013F,0,39,"V04, Antistatic Bag",2019-08-06T00:05:43.000Z,XFP-10GLR-OC192SR,XFP-10GLR-OC192SR
USEB,XFP-10GLR-OC192SR,1386954000,ONT1650052T,0,39,"V04, Antistatic Bag",2019-08-06T01:57:09.000Z,XFP-10GLR-OC192SR,XFP-10GLR-OC192SR
USEB,XFP-10GLR-OC192SR,1386954000,ONT165005AN,0,39,"V04, Antistatic Bag",2019-08-06T00:05:43.000Z,XFP-10GLR-OC192SR,XFP-10GLR-OC192SR
USEB,XFP-10GLR-OC192SR,1386954000,ONT1650044W,0,39,"V04, Antistatic Bag",2019-08-06T00:05:43.000Z,XFP-10GLR-OC192SR,XFP-10GLR-OC192SR
USEB,XFP-10GLR-OC192SR,1386954000,ONT165005E6,0,39,"V04, Antistatic Bag",2019-08-06T00:05:43.000Z,XFP-10GLR-OC192SR,XFP-10GLR-OC192SR
USEB,XFP-10GLR-OC192SR,1386954000,ECL1428009V,0,39,"V03, Antistatic Bag",2019-08-06T00:05:43.000Z,XFP-10GLR-OC192SR,XFP-10GLR-OC192SR
USEB,XFP-10GLR-OC192SR,1386954000,SPC15290A2C,0,39,"V03, Antistatic Bag",2019-08-06T00:05:43.000Z,XFP-10GLR-OC192SR,XFP-10GLR-OC192SR
USEB,XFP-10GLR-OC192SR,1386954000,SPC153105B1,0,39,"V03, Antistatic Bag",2019-08-06T00:05:43.000Z,XFP-10GLR-OC192SR,XFP-10GLR-OC192SR
USEB,XFP-10GLR-OC192SR,1386954000,SPC153309K7,0,39,"V03, Antistatic Bag",2019-08-06T00:05:43.000Z,XFP-10GLR-OC192SR,XFP-10GLR-OC192SR
USEB,XFP-10GLR-OC192SR,1386954000,ONT152610DG,0,39,"V03, Antistatic Bag",2019-08-06T01:57:09.000Z,XFP-10GLR-OC192SR,XFP-10GLR-OC192SR
NIB,XFP-10GLR-OC192SR,1386954000,ONT1044105M,0,39,"V02, Antistatic Bag",2019-08-06T01:57:09.000Z,XFP-10GLR-OC192SR,XFP-10GLR-OC192SR
USEA,XFP-10GLR-OC192SR,1386954000,AGA1520NJZY,0,39,"V03, WH,",2019-08-06T01:57:09.000Z,XFP-10GLR-OC192SR,XFP-10GLR-OC192SR
USEA,XFP-10GLR-OC192SR,1386954000,AGA1520NKG4,0,39,"V03, WH,",2019-08-06T00:05:43.000Z,XFP-10GLR-OC192SR,XFP-10GLR-OC192SR
NIB,GLC-FE-100FX-RGD,1386954000,AGP1432C1UK,0,39,"V01, WH",2019-08-06T00:05:49.000Z,GLC-FE-100FX-RGD,GLC-FE-100FX-RGD
NOB,GLC-FE-100LX-RGD#GLC-FE-100FX-RGD,1386954000,SPC15510032,0,39,"V01, WH",2019-08-06T00:37:03.000Z,GLC-FE-100LX-RGD#GLC-FE-100FX-RGD,GLC-FE-100LX-RGD
NIB,GLC-FE-100FX,1386954000,AGP1523A97Y,0,39,"V01,",2019-08-06T05:03:47.000Z,GLC-FE-100FX#GLC-FE-100FX ,GLC-FE-100FX
USEB,GLC-FE-100BX-U#GLC-FE-100BX-D,1386954000,NEC13250523,1,39,"SMD.BOX.030; 09/10/2019
",2019-10-09T03:44:35.000Z,GLC-FE-100BX-U#GLC-FE-100BX-D,GLC-FE-100BX-U
USEB,GLC-FE-100BX-U#GLC-FE-100BX-D,1386954000,NEC12160347,1,39,"SMD.BOX.030; 09/10/2019
",2019-10-09T03:44:35.000Z,GLC-FE-100BX-U#GLC-FE-100BX-D,GLC-FE-100BX-U
PART,GLC-LH-SM#GLC-LH-SM- FAKE,1386954000,AGD1231U5NF,0,39,"V01, Fake unit",2019-08-06T00:37:03.000Z,GLC-LH-SM#GLC-LH-SM- FAKE,GLC-LH-SM
PART,WS-G5484#GLC-LH-SM- FAKE,1386954000,H22L047,1,39,"SMD.BOX.025; 03/12/2019
",2019-12-03T00:49:00.000Z,WS-G5484#GLC-LH-SM- FAKE,WS-G5484
USEB,GLC-SX-MM,1386954000,AGM11421BYT,0,39,V02,2019-08-06T00:05:49.000Z,GLC-SX-MM,GLC-SX-MM
USEB,CISCO2921-SEC/K9#CISCO2921-SEC-K9,1387213200,FGL164210ZD,0,39,osi hardware,2019-08-06T00:37:03.000Z,CISCO2921-SEC/K9#CISCO2921-SEC-K9,CISCO2921-SEC/K9
USEB,CISCO2921-SEC/K9#CISCO2921-SEC-K9,1387213200,FGL164211CF,0,39,osi hardware,2019-08-06T00:37:03.000Z,CISCO2921-SEC/K9#CISCO2921-SEC-K9,CISCO2921-SEC/K9
USEB,HWIC-3G-HSPA,1386608400,FOC14262KL6,0,39,Model Note:V02,2019-08-06T05:03:47.000Z,HWIC-3G-HSPA#HWIC-3G-HSPA ,HWIC-3G-HSPA
USEB,HWIC-3G-HSPA,1386608400,FOC14214WU7,0,39,Model Note:V02,2019-08-06T05:03:47.000Z,HWIC-3G-HSPA#HWIC-3G-HSPA ,HWIC-3G-HSPA
USEB,WS-C3750G-48TS-S,1386608400,FOC1005Y07E,0,39,Model Note:V02,2019-08-06T05:03:47.000Z,WS-C3750G-48TS-S#WS-C3750G-48TS-S ,WS-C3750G-48TS-S
USEB,WS-C2960G-48TC-L,1386608400,FOC1218U4B4,0,39,Port 23 Dead,2019-08-06T00:05:50.000Z,WS-C2960G-48TC-L,WS-C2960G-48TC-L
USEB,WS-C3750G-24PS-S,1386608400,FOC1209Z24S,0,39,Model Note:V05,2019-08-06T05:03:47.000Z,WS-C3750G-24PS-S#WS-C3750G-24PS-S ,WS-C3750G-24PS-S
USEC,WS-C3750G-24TS-S1U,1386608400,FOC1223W6MJ,0,39,No PSU,2019-08-06T00:05:50.000Z,WS-C3750G-24TS-S1U,WS-C3750G-24TS-S1U
USEB,WS-C3750G-16TD-S,1386608400,CAT1036NHZ6,0,39,Model Note:V01,2019-08-06T05:03:47.000Z,WS-C3750G-16TD-S#WS-C3750G-16TD-S ,WS-C3750G-16TD-S
USEB,WS-C4948-10GE-S,1386608400,FOX1117014Y,0,39,Model Note:V06,2019-08-06T05:03:47.000Z,WS-C4948-10GE-S#WS-C4948-10GE-S ,WS-C4948-10GE-S
USEB,WS-C2960G-48TC-L,1386608400,FOC1414U015,0,39,Model Note:V04,2019-08-06T05:03:47.000Z,WS-C2960G-48TC-L#WS-C2960G-48TC-L ,WS-C2960G-48TC-L
USEC,WS-C3750G-24TS-S1U,1386608400,FOC1223W15Z,0,39,No PSU,2019-08-06T00:05:50.000Z,WS-C3750G-24TS-S1U,WS-C3750G-24TS-S1U
USEB,WS-C2960G-48TC-L,1386608400,FOC1411Z1BM,0,39,Model Note:V04,2019-08-06T05:03:47.000Z,WS-C2960G-48TC-L#WS-C2960G-48TC-L ,WS-C2960G-48TC-L
USEB,WS-C3750G-24TS-S1U,1386608400,FOC1223W6L9,0,39,Model Note:V03,2019-08-06T05:03:47.000Z,WS-C3750G-24TS-S1U#WS-C3750G-24TS-S1U ,WS-C3750G-24TS-S1U
USEB,WS-C3750G-12S-E,1386608400,FDO1324X3X3,0,39,Model Note:V11,2019-08-06T05:03:47.000Z,WS-C3750G-12S-E#WS-C3750G-12S-E ,WS-C3750G-12S-E
USEB,WS-C3750G-12S-S,1386608400,CAT1019N5GB,0,39,Model Note:V04,2019-08-06T05:03:47.000Z,WS-C3750G-12S-S#WS-C3750G-12S-S ,WS-C3750G-12S-S
USEB,WS-C3750G-12S-S,1386608400,CAT1113ZJY3,0,39,Model Note:V05,2019-08-06T05:03:47.000Z,WS-C3750G-12S-S#WS-C3750G-12S-S ,WS-C3750G-12S-S
USEB,WS-C2924-XL-EN-BU#WS-C2924-XL-EN,1386608400,FOC0523Z0G3,0,39,osi hardware,2019-08-06T00:37:03.000Z,WS-C2924-XL-EN-BU#WS-C2924-XL-EN,WS-C2924-XL-EN-BU
USEB,WS-C2924-XL-EN-BU#WS-C2924-XL-EN,1386608400,FOC0524Z0HA,0,39,osi hardware,2019-08-06T00:37:03.000Z,WS-C2924-XL-EN-BU#WS-C2924-XL-EN,WS-C2924-XL-EN-BU
USEB,AIR-LAP1142N-N-K9#AIR-LAP1142N-N/K9,1386608400,FCW1406S19H,0,39,osi hardware,2019-08-06T00:37:03.000Z,AIR-LAP1142N-N-K9#AIR-LAP1142N-N/K9,AIR-LAP1142N-N-K9
NOB,AIR-CAP3602I-A-K9,1387299600,FTX1730GHQK,0,39,osi hardware,2019-08-06T00:05:50.000Z,AIR-CAP3602I-A-K9,AIR-CAP3602I-A-K9
NOB,AIR-CAP3602I-A-K9,1387299600,FTX1703R0HM,0,39,osi hardware,2019-08-06T00:05:50.000Z,AIR-CAP3602I-A-K9,AIR-CAP3602I-A-K9
NOB,AIR-CAP3602I-A-K9,1387299600,FTX1703GNA5,0,39,osi hardware,2019-08-06T00:05:50.000Z,AIR-CAP3602I-A-K9,AIR-CAP3602I-A-K9
NOB,AIR-CAP3602I-A-K9,1387299600,FTX1730GHQP,0,39,osi hardware,2019-08-06T00:05:50.000Z,AIR-CAP3602I-A-K9,AIR-CAP3602I-A-K9
NOB,AIR-CAP3602I-A-K9,1387299600,FTX1730R0KW,0,39,osi hardware,2019-08-06T00:05:50.000Z,AIR-CAP3602I-A-K9,AIR-CAP3602I-A-K9
NOB,AIR-CAP3602I-A-K9,1387299600,FTX1703GN9W,0,39,osi hardware,2019-08-06T00:05:50.000Z,AIR-CAP3602I-A-K9,AIR-CAP3602I-A-K9
NOB,AIR-CAP3602I-A-K9,1387299600,FTX1703GNAX,0,39,osi hardware,2019-08-06T00:05:50.000Z,AIR-CAP3602I-A-K9,AIR-CAP3602I-A-K9
NOB,AIR-CAP3602I-A-K9,1387299600,FTX1730GHQN,0,39,osi hardware,2019-08-06T00:05:50.000Z,AIR-CAP3602I-A-K9,AIR-CAP3602I-A-K9
NOB,AIR-CAP3602I-A-K9,1387299600,FTX1730R0KR,0,39,osi hardware,2019-08-06T00:05:50.000Z,AIR-CAP3602I-A-K9,AIR-CAP3602I-A-K9
NOB,AIR-CAP3602I-A-K9,1387299600,FTX1730GHPM,0,39,osi hardware,2019-08-06T00:05:50.000Z,AIR-CAP3602I-A-K9,AIR-CAP3602I-A-K9
NIB,AIR-CAP3602I-A-K9,1387299600,FTX1730R0KY,0,39,osi hardware,2019-08-06T00:05:50.000Z,AIR-CAP3602I-A-K9,AIR-CAP3602I-A-K9
USEB,CISCO2821-HSEC/K9#CISCO2821 ,1387386000,FTX1204A2P0,0,39,Model Note:V04,2019-08-06T00:37:03.000Z,CISCO2821-HSEC/K9#CISCO2821 ,CISCO2821-HSEC/K9
USEB,CISCO2821-HSEC/K9#CISCO2821 ,1387386000,FTX1216A3XS,0,39,Model Note:V04,2019-08-06T00:37:03.000Z,CISCO2821-HSEC/K9#CISCO2821 ,CISCO2821-HSEC/K9
USEB,CISCO2821-SRST/K9#CISCO2821 ,1387386000,FHK1316F1WW,0,39,Model Note:V04,2019-08-06T00:37:03.000Z,CISCO2821-SRST/K9#CISCO2821 ,CISCO2821-SRST/K9
USEB,WS-C3750X-48P-S,1387386000,FDO1542K195,0,39,Model Note:V02,2019-08-06T05:03:47.000Z,WS-C3750X-48P-S#WS-C3750X-48P-S ,WS-C3750X-48P-S
USEB,ME-C3750-24TE-M,1387386000,FDO1205X0FD,0,39,Model Note:V06,2019-08-06T05:03:47.000Z,ME-C3750-24TE-M#ME-C3750-24TE-M ,ME-C3750-24TE-M
USEB,WS-C3750-48PS-S,1387386000,CAT1034NJGS,0,39,Model Note:V05,2019-08-06T05:03:47.000Z,WS-C3750-48PS-S#WS-C3750-48PS-S ,WS-C3750-48PS-S
USEB,WS-C3750-24PS-S,1387386000,FDO1330X3NZ,0,39,"WH by Long,
No SN label",2019-08-06T00:05:50.000Z,WS-C3750-24PS-S,WS-C3750-24PS-S
USEB,WS-C3750G-48TS-S,1387386000,FOC0944Y4TR,0,39,Model Note:V02,2019-08-06T05:03:47.000Z,WS-C3750G-48TS-S#WS-C3750G-48TS-S ,WS-C3750G-48TS-S
USEB,WS-C3750G-48TS-S,1387386000,FOC1226Z04L,0,39,Model Note:V02,2019-08-06T05:03:47.000Z,WS-C3750G-48TS-S#WS-C3750G-48TS-S ,WS-C3750G-48TS-S
USEB,WS-C3750G-48TS-S,1387386000,FOC1131Y4AP,0,39,Model Note:V02,2019-08-06T05:03:47.000Z,WS-C3750G-48TS-S#WS-C3750G-48TS-S ,WS-C3750G-48TS-S
USEB,WS-C3750G-48TS-S,1387386000,FOC1131Y48E,0,39,Model Note:V02,2019-08-06T05:03:47.000Z,WS-C3750G-48TS-S#WS-C3750G-48TS-S ,WS-C3750G-48TS-S
USEB,WS-C3750G-48TS-S,1387386000,FOC0941U3DE,0,39,Model Note:V02,2019-08-06T05:03:47.000Z,WS-C3750G-48TS-S#WS-C3750G-48TS-S ,WS-C3750G-48TS-S
USEB,WS-C3750G-48TS-S,1387386000,FOC0924U227,0,39,Model Note:V02,2019-08-06T05:03:47.000Z,WS-C3750G-48TS-S#WS-C3750G-48TS-S ,WS-C3750G-48TS-S
USEB,WS-C3750G-48TS-S,1387386000,FOC1124Z2TR,0,39,Model Note:V02,2019-08-06T05:03:47.000Z,WS-C3750G-48TS-S#WS-C3750G-48TS-S ,WS-C3750G-48TS-S
USEB,WS-C3750G-48TS-S,1387386000,FOC0944Y4MR,0,39,Model Note:V02,2019-08-06T05:03:47.000Z,WS-C3750G-48TS-S#WS-C3750G-48TS-S ,WS-C3750G-48TS-S
USEB,WS-C3750G-48TS-S,1387386000,FOC0929U199,0,39,Model Note:V02,2019-08-06T05:03:47.000Z,WS-C3750G-48TS-S#WS-C3750G-48TS-S ,WS-C3750G-48TS-S
USEB,WS-C3750G-48TS-E,1387386000,FOC0943Y05H,0,39,Model Note:V02,2019-08-06T05:03:47.000Z,WS-C3750G-48TS-E#WS-C3750G-48TS-E ,WS-C3750G-48TS-E
USEB,WS-C3560G-48PS-S,1387386000,FOC1444Y4VX,0,39,Model Note:V08,2019-08-06T05:03:47.000Z,WS-C3560G-48PS-S#WS-C3560G-48PS-S ,WS-C3560G-48PS-S
USEB,WS-C2960S-24PS-L,1387386000,FOC1617W0JY,0,39,Model Note:V03,2019-08-06T05:03:47.000Z,WS-C2960S-24PS-L#WS-C2960S-24PS-L ,WS-C2960S-24PS-L
USEB,WS-C2960S-24PS-L,1387386000,FOC1621Z2ZM,0,39,Model Note:V03,2019-08-06T05:03:47.000Z,WS-C2960S-24PS-L#WS-C2960S-24PS-L ,WS-C2960S-24PS-L
USEB,WS-C2960S-48FPS-L,1387386000,FOC1621W0BL,0,39,Model Note:V03,2019-08-06T05:03:47.000Z,WS-C2960S-48FPS-L#WS-C2960S-48FPS-L ,WS-C2960S-48FPS-L
USEB,C2960S-STACK,1387386000,FOC16190Q0U,0,39,Model Note:V02,2019-08-06T05:03:47.000Z,C2960S-STACK#C2960S-STACK ,C2960S-STACK
USEB,C2960S-STACK,1387386000,FOC16190PPH,0,39,Model Note:V02,2019-08-06T05:03:47.000Z,C2960S-STACK#C2960S-STACK ,C2960S-STACK
USEB,AIM-VPN/SSL-2,1387472400,FOC12133RN9,0,39,Model Note:V01,2019-08-06T05:03:47.000Z,AIM-VPN/SSL-2#AIM-VPN/SSL-2 ,AIM-VPN/SSL-2
USEB,AIM-VPN/SSL-2,1387472400,FOC11512BNX,0,39,Model Note:V01,2019-08-06T05:03:47.000Z,AIM-VPN/SSL-2#AIM-VPN/SSL-2 ,AIM-VPN/SSL-2
USEB,WS-C2960-48PST-L,1387472400,FOC1334Z1UB,0,39,Model Note:V01,2019-08-06T05:03:47.000Z,WS-C2960-48PST-L#WS-C2960-48PST-L ,WS-C2960-48PST-L
USEB,WS-C3750G-48PS-E,1387731600,FOC1147Z2AC,0,39,Model Note:V05,2019-08-06T05:03:47.000Z,WS-C3750G-48PS-E#WS-C3750G-48PS-E ,WS-C3750G-48PS-E
NOB,AIR-CT2504-25-K9#AIR-CT2504-K9,1387731600,PSZ17220HGU,0,39,osi hardware,2019-08-06T00:37:03.000Z,AIR-CT2504-25-K9#AIR-CT2504-K9,AIR-CT2504-25-K9
USEB,WS-C3560-48PS-S,1387731600,CAT1017Z1L4,0,39,Model Note:V04,2019-08-06T05:03:47.000Z,WS-C3560-48PS-S#WS-C3560-48PS-S ,WS-C3560-48PS-S
USEB,WS-C3750-24TS-S,1387731600,CAT1117ZGDE,0,39,Model Note:V05,2019-08-06T05:03:47.000Z,WS-C3750-24TS-S#WS-C3750-24TS-S ,WS-C3750-24TS-S
USEB,WS-C3560-48PS-S,1387731600,CAT1017Z1JP,0,39,Model Note:V04,2019-08-06T05:03:47.000Z,WS-C3560-48PS-S#WS-C3560-48PS-S ,WS-C3560-48PS-S
USEB,WS-C3560-24PS-S,1387731600,CAT0943R0FH,0,39,Model Note:V05,2019-08-06T00:05:51.000Z,WS-C3560-24PS-S,WS-C3560-24PS-S
USEB,WS-C3560-24PS-S,1387731600,CAT0948R3DX,0,39,Model Note:V05,2019-08-06T00:05:51.000Z,WS-C3560-24PS-S,WS-C3560-24PS-S
USEB,WS-C3750G-12S-S,1387731600,CAT1016Z5RZ,0,39,Model Note:V04,2019-08-06T05:03:47.000Z,WS-C3750G-12S-S#WS-C3750G-12S-S ,WS-C3750G-12S-S
USEB,WS-C3560-24TS-S,1387731600,CAT1102ZJUN,0,39,Model Note:V02,2019-08-06T05:03:47.000Z,WS-C3560-24TS-S#WS-C3560-24TS-S ,WS-C3560-24TS-S
USEB,ASA5510-SEC-BUN-K9,1387731600,JMX1226L025,0,39,"Model Note:V03, Broken Ejector",2019-08-06T00:05:51.000Z,ASA5510-SEC-BUN-K9,ASA5510-SEC-BUN-K9
USEB,XFP-10GER-OC192IR,1387731600,ECL123501ER,0,39,"V01, Antistatic Bag",2019-08-06T00:05:52.000Z,XFP-10GER-OC192IR,XFP-10GER-OC192IR
USEB,XFP-10GER-OC192IR,1387731600,ECL123402XE,0,39,"V01, Antistatic Bag",2019-08-06T00:05:52.000Z,XFP-10GER-OC192IR,XFP-10GER-OC192IR
NIB,XFP10GLR-192SR-L,1387731600,AGA1444N0G2,1,39,"SMD.BOX.009; 09/10/2019
",2019-10-09T00:07:33.000Z,XFP10GLR-192SR-L,XFP10GLR-192SR-L
NIB,XFP10GLR-192SR-L,1387731600,AGA1443NYYU,1,39,"SMD.BOX.009; 09/10/2019
",2019-10-09T00:07:34.000Z,XFP10GLR-192SR-L,XFP10GLR-192SR-L
NIB,XFP10GLR-192SR-L,1387731600,AGA1443NYRC,1,39,"SMD.BOX.009; 09/10/2019
",2019-10-09T00:07:33.000Z,XFP10GLR-192SR-L,XFP10GLR-192SR-L
NIB,XFP10GLR-192SR-L,1387731600,AGA1443NYEC,0,39,"V01,",2019-08-06T00:05:52.000Z,XFP10GLR-192SR-L,XFP10GLR-192SR-L
NIB,XFP10GLR-192SR-L,1387731600,AGA1444N0FT,1,39,"SMD.BOX.009; 09/10/2019
",2019-10-09T00:07:35.000Z,XFP10GLR-192SR-L,XFP10GLR-192SR-L
NIB,XFP10GLR-192SR-L,1387731600,AGA1441NWNG,1,39,"SMD.BOX.009; 09/10/2019
",2019-10-09T00:07:34.000Z,XFP10GLR-192SR-L,XFP10GLR-192SR-L
NIB,XFP10GLR-192SR-L,1387731600,AGA1443NYEG,1,39,"SMD.BOX.009; 09/10/2019
",2019-10-09T00:07:34.000Z,XFP10GLR-192SR-L,XFP10GLR-192SR-L
NIB,XFP10GLR-192SR-L,1387731600,AGA1444N0FX,1,39,"SMD.BOX.009; 09/10/2019
",2019-10-09T00:07:34.000Z,XFP10GLR-192SR-L,XFP10GLR-192SR-L
NIB,XFP10GLR-192SR-L,1387731600,AGA1443NYH1,1,39,"SMD.BOX.009; 09/10/2019
",2019-10-09T00:07:34.000Z,XFP10GLR-192SR-L,XFP10GLR-192SR-L
NIB,XFP-10GZR-OC192LR,1387731600,FLJ1543F033,0,39,"V03, WH,",2019-08-06T00:05:52.000Z,XFP-10GZR-OC192LR,XFP-10GZR-OC192LR
NIB,XFP-10GZR-OC192LR,1387731600,FLJ1544F053,0,39,"V03, WH,",2019-08-06T00:05:52.000Z,XFP-10GZR-OC192LR,XFP-10GZR-OC192LR
NIB,XFP-10GZR-OC192LR,1387731600,FLJ1538F00S,0,39,"V03, WH,",2019-08-06T00:05:52.000Z,XFP-10GZR-OC192LR,XFP-10GZR-OC192LR
USEB,CP-7925G-A-K9#CP-7925G-W-K9,1387731600,IAC1309A05Z,0,39,"Please double check the battery, charger & desk charger qty before quote customers.",2019-08-06T01:57:10.000Z,CP-7925G-A-K9#CP-7925G-W-K9,CP-7925G-A-K9
USEB,CP-7925G-W-K9,1387731600,IAC1447A1KD,0,39,"Please double check the battery, charger & desk charger qty before quote customers.",2019-08-06T00:05:56.000Z,CP-7925G-W-K9,CP-7925G-W-K9
USEB,CP-7925G-W-K9,1387731600,IAC1405A01U,0,39,"Please double check the battery, charger & desk charger qty before quote customers.",2019-08-06T01:57:10.000Z,CP-7925G-W-K9,CP-7925G-W-K9
USEB,CP-7925G-A-K9#CP-7925G-W-K9,1387731600,IAC1251A01L,0,39,"Please double check the battery, charger & desk charger qty before quote customers.",2019-08-06T01:57:10.000Z,CP-7925G-A-K9#CP-7925G-W-K9,CP-7925G-A-K9
USEB,CP-7925G-W-K9,1387731600,IAC1447A119,0,39,"Please double check the battery, charger & desk charger qty before quote customers.",2019-08-06T00:05:56.000Z,CP-7925G-W-K9,CP-7925G-W-K9
USEB,CP-7925G-W-K9,1387731600,IAC1447A3JQ,0,39,"Please double check the battery, charger & desk charger qty before quote customers.",2019-08-06T00:05:56.000Z,CP-7925G-W-K9,CP-7925G-W-K9
USEB,CP-7925G-W-K9,1387731600,IAC1251A1MU,0,39,"Please double check the battery, charger & desk charger qty before quote customers.",2019-08-06T00:05:56.000Z,CP-7925G-W-K9,CP-7925G-W-K9
USEB,CP-7925G-W-K9,1387731600,IAC1651A07F,0,39,"Please double check the battery, charger & desk charger qty before quote customers.",2019-08-06T00:05:56.000Z,CP-7925G-W-K9,CP-7925G-W-K9
USEB,CP-7925G-W-K9,1387731600,IAC1444A2MQ,0,39,"Please double check the battery, charger & desk charger qty before quote customers.",2019-08-06T00:05:56.000Z,CP-7925G-W-K9,CP-7925G-W-K9
USEB,CP-7925G-W-K9,1387731600,IAC1602A0QS,0,39,"Please double check the battery, charger & desk charger qty before quote customers.",2019-08-06T00:05:56.000Z,CP-7925G-W-K9,CP-7925G-W-K9
USEB,CP-7921G-W-K9,1387731600,IAC115100LG,0,39,"Please double check the battery, charger & desk charger qty before quote customers.",2019-08-06T00:05:56.000Z,CP-7921G-W-K9,CP-7921G-W-K9
USEB,CP-7921G-W-K9,1387731600,IAC112600C9,0,39,"Please double check the battery, charger & desk charger qty before quote customers.",2019-08-06T00:05:56.000Z,CP-7921G-W-K9,CP-7921G-W-K9
USEB,CP-7921G-W-K9,1387731600,IAC1453010A,0,39,"Please double check the battery, charger & desk charger qty before quote customers.",2019-08-06T00:05:56.000Z,CP-7921G-W-K9,CP-7921G-W-K9
NOB,CISCO881GW-GN-A-K9#C881SRSTW-GN-A-K9,1387731600,FTX1504021A,0,39,"Wrong Box 
SFTX13428259,

8.3.8.2.0",2019-08-06T00:37:10.000Z,CISCO881GW-GN-A-K9#C881SRSTW-GN-A-K9,CISCO881GW-GN-A-K9
NOB,CISCO887VA-M-K9,1387731600,FCZ1628928V,0,39,SN label Damaged,2019-08-06T05:03:47.000Z,CISCO887VA-M-K9#CISCO887VA-M-K9 ,CISCO887VA-M-K9
USEA,CISCO857W-G-A-K9,1387731600,FHK112813R8,0,39,Box with no SN label outside,2019-08-06T05:03:47.000Z,CISCO857W-G-A-K9#CISCO857W-G-A-K9 ,CISCO857W-G-A-K9
USEA,CISCO857W-G-A-K9,1387731600,FHK1221223C,0,39,Model Note:V05,2019-08-06T05:03:47.000Z,CISCO857W-G-A-K9#CISCO857W-G-A-K9 ,CISCO857W-G-A-K9
USEA,CISCO857W-G-A-K9,1387731600,FHK1221225U,0,39,Model Note:V05,2019-08-06T05:03:47.000Z,CISCO857W-G-A-K9#CISCO857W-G-A-K9 ,CISCO857W-G-A-K9
NOB,ME-3400G-2CS-A,1387731600,FOC1230U4DN,0,39,SN does not match on the box,2019-08-06T05:03:47.000Z,ME-3400G-2CS-A#ME-3400G-2CS-A ,ME-3400G-2CS-A
NIB,WS-X4904-10GE=,1387731600,JAE14300P6U,0,39,"WH by Long,",2019-08-06T00:05:56.000Z,WS-X4904-10GE,WS-X4904-10GE
NIB,VWIC2-1MFT-T1/E1=,1387731600,FOC13131C26,0,39,WH by Trung,2019-08-06T00:05:56.000Z,VWIC2-1MFT-T1/E1,VWIC2-1MFT-T1/E1
NIB,VWIC2-1MFT-T1/E1=,1387731600,FOC13123GW5,0,39,WH by Trung,2019-08-06T00:05:56.000Z,VWIC2-1MFT-T1/E1,VWIC2-1MFT-T1/E1
USEA,NME-WAE-302-K9,1387731600,FOC12034VAC,1,39,"Does not have SN label on box,",2019-08-06T00:05:57.000Z,NME-WAE-302-K9,NME-WAE-302-K9
NOB,NME-WAE-302-K9,1387731600,FOC12034VC6,1,39,"Does not have SN label on box,",2019-08-06T00:05:57.000Z,NME-WAE-302-K9,NME-WAE-302-K9
NOB,NME-WAE-302-K9,1387731600,FOC12034V91,1,39,"Does not have SN label on box,",2019-08-06T00:05:57.000Z,NME-WAE-302-K9,NME-WAE-302-K9
NOB,NME-WAE-302-K9,1387731600,FOC12034V6Y,1,39,"Does not have SN label on box,",2019-08-06T00:05:57.000Z,NME-WAE-302-K9,NME-WAE-302-K9
USEA,NME-WAE-302-K9,1387731600,FOC12105E4U,1,39,"Does not have SN label on box,",2019-08-06T00:05:57.000Z,NME-WAE-302-K9,NME-WAE-302-K9
NOB,CP-7925G-W-K9=,1387731600,IAC1719A2QT,0,39,"Battery, charger may not include, Please double check before shipping",2019-08-06T00:05:57.000Z,CP-7925G-W-K9,CP-7925G-W-K9
NOB,CP-7925G-W-K9=,1387731600,IAC1725A40F,0,39,"Battery, charger may not include, Please double check before shipping",2019-08-06T00:05:57.000Z,CP-7925G-W-K9,CP-7925G-W-K9
NOB,CP-7925G-W-K9=,1387731600,IAC1651A08F,0,39,"Battery, charger may not include, Please double check before shipping",2019-08-06T00:05:57.000Z,CP-7925G-W-K9,CP-7925G-W-K9
NOB,CP-7925G-W-K9=,1387731600,IAC1716A4ZD,0,39,"Battery, charger may not include, Please double check before shipping",2019-08-06T00:05:57.000Z,CP-7925G-W-K9,CP-7925G-W-K9
NOB,CP-7925G-W-K9=,1387731600,IAC1724A2V2,0,39,"Battery, charger may not include, Please double check before shipping",2019-08-06T00:05:57.000Z,CP-7925G-W-K9,CP-7925G-W-K9
NOB,CP-7925G-W-K9=,1387731600,IAC1704A6SB,0,39,"Battery, charger may not include, Please double check before shipping",2019-08-06T00:05:57.000Z,CP-7925G-W-K9,CP-7925G-W-K9
NOB,CP-7925G-W-K9=,1387731600,IAC1725A3GV,0,39,"Battery, charger may not include, Please double check before shipping",2019-08-06T00:05:57.000Z,CP-7925G-W-K9,CP-7925G-W-K9
NOB,CP-7925G-W-K9=,1387731600,IAC1651A1K3,0,39,"Battery, charger may not include, Please double check before shipping",2019-08-06T00:05:57.000Z,CP-7925G-W-K9,CP-7925G-W-K9
NOB,CP-7925G-W-K9=,1387731600,IAC1732A0GR,0,39,"Battery, charger may not include, Please double check before shipping",2019-08-06T00:05:57.000Z,CP-7925G-W-K9,CP-7925G-W-K9
NOB,CP-7925G-W-K9=,1387731600,IAC1732A0VP,0,39,"Battery, charger may not include, Please double check before shipping",2019-08-06T01:57:10.000Z,CP-7925G-W-K9,CP-7925G-W-K9
NOB,CP-7925G-W-K9=,1387731600,IAC1651A1TC,0,39,"Battery, charger may not include, Please double check before shipping",2019-08-06T00:05:57.000Z,CP-7925G-W-K9,CP-7925G-W-K9
NOB,CP-7925G-W-K9=,1387731600,IAC1651A12J,0,39,"Battery, charger may not include, Please double check before shipping",2019-08-06T00:05:57.000Z,CP-7925G-W-K9,CP-7925G-W-K9
NOB,CP-7925G-W-K9=,1387731600,IAC1651A1LQ,0,39,"Battery, charger may not include, Please double check before shipping",2019-08-06T00:05:57.000Z,CP-7925G-W-K9,CP-7925G-W-K9
NOB,CP-7925G-A-K9#CP-7925G-W-K9=,1387731600,IAC1651A0JA,0,39,"Battery, charger may not include, Please double check before shipping",2019-08-06T01:57:10.000Z,CP-7925G-A-K9#CP-7925G-W-K9,CP-7925G-A-K9
NOB,CP-7925G-W-K9=,1387731600,IAC1639A3BY,0,39,"Battery, charger may not include, Please double check before shipping",2019-08-06T00:05:57.000Z,CP-7925G-W-K9,CP-7925G-W-K9
NOB,CP-7925G-W-K9=,1387731600,IAC1719A3CF,0,39,"Battery, charger may not include, Please double check before shipping",2019-08-06T00:05:57.000Z,CP-7925G-W-K9,CP-7925G-W-K9
NOB,CP-7925G-W-K9=,1387731600,IAC1725A3H6,0,39,"Battery, charger may not include, Please double check before shipping",2019-08-06T00:05:57.000Z,CP-7925G-W-K9,CP-7925G-W-K9
NOB,CP-7925G-W-K9=,1387731600,IAC1725A1GH,0,39,"Battery, charger may not include, Please double check before shipping",2019-08-06T00:05:57.000Z,CP-7925G-W-K9,CP-7925G-W-K9
NOB,CP-7925G-W-K9=,1387731600,IAC1732A07Y,0,39,"Battery, charger may not include, Please double check before shipping",2019-08-06T00:05:57.000Z,CP-7925G-W-K9,CP-7925G-W-K9
NOB,CP-7925G-W-K9=,1387731600,IAC1651A1QA,0,39,"Battery, charger may not include, Please double check before shipping",2019-08-06T00:05:57.000Z,CP-7925G-W-K9,CP-7925G-W-K9
NOB,CP-7925G-W-K9=,1387731600,IAC1732A0EC,0,39,"Battery, charger may not include, Please double check before shipping",2019-08-06T00:05:57.000Z,CP-7925G-W-K9,CP-7925G-W-K9
NOB,CP-7925G-W-K9=,1387731600,IAC1651A24F,0,39,"Battery, charger may not include, Please double check before shipping",2019-08-06T00:05:57.000Z,CP-7925G-W-K9,CP-7925G-W-K9
NOB,CP-7925G-W-K9=,1387731600,IAC1651A16F,0,39,"Battery, charger may not include, Please double check before shipping",2019-08-06T00:05:57.000Z,CP-7925G-W-K9,CP-7925G-W-K9
NOB,CP-7925G-W-K9=,1387731600,IAC1651A173,0,39,"Battery, charger may not include, Please double check before shipping",2019-08-06T00:05:57.000Z,CP-7925G-W-K9,CP-7925G-W-K9
NOB,CP-7925G-W-K9=,1387731600,IAC1651A0GT,0,39,"Battery, charger may not include, Please double check before shipping",2019-08-06T00:05:57.000Z,CP-7925G-W-K9,CP-7925G-W-K9
NOB,CP-7925G-W-K9=,1387731600,IAC1643A1B6,0,39,"Battery, charger may not include, Please double check before shipping",2019-08-06T00:05:57.000Z,CP-7925G-W-K9,CP-7925G-W-K9
NOB,CP-7925G-W-K9=,1387731600,IAC1716A4XD,0,39,"Battery, charger may not include, Please double check before shipping",2019-08-06T00:05:57.000Z,CP-7925G-W-K9,CP-7925G-W-K9
NOB,CP-7925G-A-K9#CP-7925G-W-K9=,1387731600,IAC1719A3FC,0,39,"Battery, charger may not include, Please double check before shipping",2019-08-06T01:57:10.000Z,CP-7925G-A-K9#CP-7925G-W-K9,CP-7925G-A-K9
NOB,CP-7925G-W-K9=,1387731600,IAC1716A4Z4,0,39,"Battery, charger may not include, Please double check before shipping",2019-08-06T00:05:57.000Z,CP-7925G-W-K9,CP-7925G-W-K9
NOB,CP-7925G-W-K9=,1387731600,IAC1651A1W6,0,39,"Battery, charger may not include, Please double check before shipping",2019-08-06T00:05:57.000Z,CP-7925G-W-K9,CP-7925G-W-K9
NOB,CP-7925G-W-K9=,1387731600,IAC1651A0VT,0,39,"Battery, charger may not include, Please double check before shipping",2019-08-06T00:05:57.000Z,CP-7925G-W-K9,CP-7925G-W-K9
NIB,CP-7914,1387731600,FCH121092WY,1,39,"8.3.1.3.B; 11/05/2020
",2020-05-11T01:51:50.000Z,CP-7914,CP-7914
NOB,CP-7941G-CH1,1387731600,FCH12508P55,1,39,"WH by Long,",2019-08-06T00:05:57.000Z,CP-7941G-CH1,CP-7941G-CH1
NOB,CP-7941G-CH1,1387731600,FCH12508PVD,1,39,"WH by Long,",2019-08-06T00:05:57.000Z,CP-7941G-CH1,CP-7941G-CH1
NOB,CP-7940G=,1387731600,FCH1216E7H2,0,39,WH by Long,2019-08-06T00:05:57.000Z,CP-7940G,CP-7940G
NOB,HWIC-AP-AG-A=,1387731600,FOC0940174Z,0,39,"WH,",2019-08-06T00:05:57.000Z,HWIC-AP-AG-A,HWIC-AP-AG-A
NOB,CVR-X2-SFP,1387731600,FDO12330LMC,1,39,"8.3.6.1.B; 15/10/2019
",2019-10-14T23:26:55.000Z,CVR-X2-SFP,CVR-X2-SFP
NOB,CVR-X2-SFP,1387731600,FDO143300ZU,1,39,"8.3.6.1.B; 15/10/2019
",2019-10-14T23:26:55.000Z,CVR-X2-SFP,CVR-X2-SFP
USEC,HWIC-4SHDSL=,1477501200,FOC14260HRW,1,39,"8.md.box.32; 18/09/2019
",2019-09-18T04:06:16.000Z,HWIC-4SHDSL,HWIC-4SHDSL
NIB,VIC2-2BRI-NT/TE,1387731600,FOC13316FHB,0,39,"WH,",2019-08-06T00:05:57.000Z,VIC2-2BRI-NT/TE,VIC2-2BRI-NT/TE
USEA,EHWIC-1GE-SFP-CU,1387731600,FOC172314TG,0,39,"Newable,",2019-08-06T05:03:47.000Z,EHWIC-1GE-SFP-CU#EHWIC-1GE-SFP-CU ,EHWIC-1GE-SFP-CU
USEA,EHWIC-1GE-SFP-CU,1387731600,FOC172314YH,0,39,"Newable,",2019-08-06T05:03:47.000Z,EHWIC-1GE-SFP-CU#EHWIC-1GE-SFP-CU ,EHWIC-1GE-SFP-CU
USEA,HWIC-3G-HSPA-G,1387731600,FOC143134G2,0,39,"Newable,",2019-08-06T05:03:47.000Z,HWIC-3G-HSPA-G#HWIC-3G-HSPA-G ,HWIC-3G-HSPA-G
NIB,CISCO1801/K9,1387731600,FGL1621249J,0,39,"WH by Long,",2019-08-06T00:05:57.000Z,CISCO1801/K9,CISCO1801/K9
NOB,ME-C3750-24TE-M,1387731600,FDO1329X1CU,1,39,"WH by GIang,",2019-08-06T00:05:57.000Z,ME-C3750-24TE-M,ME-C3750-24TE-M
USEB,WS-C3750X-24P-L,1387731600,FDO1628Z1FL,0,39,"Return from Curvature,  
Face leftside damaged,
WH by Long,",2019-08-06T01:57:10.000Z,WS-C3750X-24P-L,WS-C3750X-24P-L
NIB,WS-C3750E-24PD-E,1387731600,FDO1343V0DJ,1,39,"re-wh by Giang 
--------
8.2.2.2.C,",2019-08-06T00:05:57.000Z,WS-C3750E-24PD-E,WS-C3750E-24PD-E
NIB,WS-C3750E-48TD-S,1387731600,FDO1248R0QS,1,39,"re-wh by Giang 

---------
8.2.3.3.C,",2019-08-06T00:05:57.000Z,WS-C3750E-48TD-S,WS-C3750E-48TD-S
NOB,WS-C2960S-24PD-L,1387731600,FOC1439Z44Q,0,39,Model Note:V02,2019-08-06T05:03:47.000Z,WS-C2960S-24PD-L#WS-C2960S-24PD-L ,WS-C2960S-24PD-L
NOB,UC520-48U-6BRI-K9,1387731600,FHK1218F1UU,1,39,"WH by Long
-----------
8.2.6.2.A,",2019-08-06T00:05:58.000Z,UC520-48U-6BRI-K9,UC520-48U-6BRI-K9
NOB,SCE2020-4XGBE-MM,1388077200,CAT1245G00V,1,39,"WH by Long,",2019-08-06T00:05:58.000Z,SCE2020-4XGBE-MM,SCE2020-4XGBE-MM
NOB,SCE2020-4XGBE-MM,1388077200,CAT1220G04C,1,39,"WH by Long,",2019-08-06T00:05:58.000Z,SCE2020-4XGBE-MM,SCE2020-4XGBE-MM
NIB,SCE2020-4XGBE-MM,1388077200,CAT1242G01C,1,39,"WH by Long,",2019-08-06T00:05:58.000Z,SCE2020-4XGBE-MM,SCE2020-4XGBE-MM
USEA,WS-C2960-24TT-L,1388077200,FOC1146X26K,0,39,Model Note:V03,2019-08-06T05:03:47.000Z,WS-C2960-24TT-L#WS-C2960-24TT-L ,WS-C2960-24TT-L
USEA,WS-C2960-24TT-L,1388077200,FOC1146X25U,0,39,Model Note:V03,2019-08-06T05:03:47.000Z,WS-C2960-24TT-L#WS-C2960-24TT-L ,WS-C2960-24TT-L
NOB,CISCO1811/K9,1388077200,FHK112418DG,0,39,"WH by Long,",2019-08-06T00:05:58.000Z,CISCO1811/K9,CISCO1811/K9
NOB,CISCO1801W-AG-E/K9#CISCO1801W ,1388077200,FHK1010227D,0,39,Model Note:V01,2019-08-06T00:37:10.000Z,CISCO1801W-AG-E/K9#CISCO1801W ,CISCO1801W-AG-E/K9
USEB,WS-C3750V2-24PS-S,1388336400,FDO1535X171,0,39,Model Note:V07,2019-08-06T00:05:58.000Z,WS-C3750V2-24PS-S,WS-C3750V2-24PS-S
USEB,WS-C3750V2-48PS-S,1388336400,FDO1545Y2QG,0,39,Model Note:V08,2019-08-06T05:03:47.000Z,WS-C3750V2-48PS-S#WS-C3750V2-48PS-S ,WS-C3750V2-48PS-S
NOB,CISCO887-SEC-K9,1388336400,FCZ1521C47Q,1,39,"WH by Long, Match SN",2019-08-06T00:05:58.000Z,CISCO887-SEC-K9,CISCO887-SEC-K9
USEA,ASA5510-SEC-BUN-K9,1388336400,JMX1322L0CH,0,39,osi hardware,2019-08-06T00:05:58.000Z,ASA5510-SEC-BUN-K9,ASA5510-SEC-BUN-K9
USEB,C2911-VSEC/K9,1388336400,FGL162311JB,0,39,"Return from NHR
Conner damaged",2019-08-06T01:57:10.000Z,C2911-VSEC/K9,C2911-VSEC/K9
USEB,CISCO2801,1388336400,FHK1301F12W,0,39,Model Note:V05,2019-08-06T05:03:47.000Z,CISCO2801#CISCO2801 ,CISCO2801
USEB,HWIC-3G-HSPA,1388336400,FOC15213ZT1,0,39,Model Note:V02,2019-08-06T05:03:47.000Z,HWIC-3G-HSPA#HWIC-3G-HSPA ,HWIC-3G-HSPA
USEB,WS-C2960-24TT-L,1389027600,FOC1050ZB28,0,39,Model Note:V03,2019-08-06T05:03:47.000Z,WS-C2960-24TT-L#WS-C2960-24TT-L ,WS-C2960-24TT-L
USEB,WS-C2960-24TC-L#WS-C2960-24TT-L ,1389027600,FOC1019Z28T,0,39,Model Note:V03,2019-08-06T00:37:10.000Z,WS-C2960-24TC-L#WS-C2960-24TT-L ,WS-C2960-24TC-L
USEB,WS-C2960-24TT-L,1389027600,FOC1237X2B5,0,39,Model Note:V03,2019-08-06T05:03:47.000Z,WS-C2960-24TT-L#WS-C2960-24TT-L ,WS-C2960-24TT-L
USEB,WS-C2960-48TT-S,1389027600,FCQ1618X39U,0,39,Model Note:V05,2019-08-06T05:03:47.000Z,WS-C2960-48TT-S#WS-C2960-48TT-S ,WS-C2960-48TT-S
USEB,WS-C2960-48TT-L,1389027600,FOC1306V91K,0,39,Model Note:V04,2019-08-06T00:06:04.000Z,WS-C2960-48TT-L,WS-C2960-48TT-L
USEB,HWIC-3G-HSPA,1389027600,FOC13183SPB,0,39,Model Note:V01,2019-08-06T05:03:47.000Z,HWIC-3G-HSPA#HWIC-3G-HSPA ,HWIC-3G-HSPA
USEB,CISCO1841-HSEC/K9#CISCO1841,1389027600,FHK1001502L,0,39,osi hardware,2019-08-06T00:37:10.000Z,CISCO1841-HSEC/K9#CISCO1841,CISCO1841-HSEC/K9
USEB,CISCO1841-SEC/K9#CISCO1841,1389027600,FHK124827VL,0,39,osi hardware,2019-08-06T00:37:10.000Z,CISCO1841-SEC/K9#CISCO1841,CISCO1841-SEC/K9
USEB,CISCO887G-K9,1389027600,FGL154726ZW,0,39,Port 3 dedicated for AIR-LAB1252AG,2019-08-06T00:06:04.000Z,CISCO887G-K9,CISCO887G-K9
USEB,CISCO887W-GN-E-K9,1389027600,FCZ1425C016,0,39,Damaged antennas,2019-08-06T00:06:04.000Z,CISCO887W-GN-E-K9,CISCO887W-GN-E-K9
USEB,C881SRSTW-GN-A-K9#CISCO881SRSTW-GN-A-K9,1389027600,FTX150403YZ,0,39,Damaged antenna,2019-08-06T00:37:10.000Z,C881SRSTW-GN-A-K9#CISCO881SRSTW-GN-A-K9,C881SRSTW-GN-A-K9
USEB,C881SRSTW-GN-A-K9,1389027600,FTX15040586,0,39,Model Note:V02,2019-08-06T05:03:47.000Z,C881SRSTW-GN-A-K9#C881SRSTW-GN-A-K9 ,C881SRSTW-GN-A-K9
USEB,CISCO881G-K9,1389027600,FCZ144593V9,0,39,Model Note:V01,2019-08-06T05:03:47.000Z,CISCO881G-K9#CISCO881G-K9 ,CISCO881G-K9
USEB,CISCO891-K9,1389027600,FTX1504017U,0,39,Model Note:V01,2019-08-06T05:03:47.000Z,CISCO891-K9#CISCO891-K9 ,CISCO891-K9
USEB,CISCO887VA-SEC-K9,1389027600,FCZ1650C1FQ,0,39,Model Note:V02,2019-08-06T00:06:04.000Z,CISCO887VA-SEC-K9,CISCO887VA-SEC-K9
USEB,CISCO887VA-SEC-K9,1389027600,FCZ1650C1FS,0,39,Model Note:V02,2019-08-06T05:03:47.000Z,CISCO887VA-SEC-K9#CISCO887VA-SEC-K9 ,CISCO887VA-SEC-K9
USEB,CISCO888-SEC-K9,1389027600,FCZ163190EG,0,39,"WH by Long,",2019-08-06T00:06:04.000Z,CISCO888-SEC-K9,CISCO888-SEC-K9
USEB,C887VA-W-A-K9#CISCO887VA-W-A-K9,1389027600,FTX160383N9,0,39,Model Note:V01,2019-08-06T00:37:10.000Z,C887VA-W-A-K9#CISCO887VA-W-A-K9,C887VA-W-A-K9
USEB,C886VAG+7-K9#CISCO886VAG+7-K9,1389027600,FCZ160490BS,0,39,"WH by Long,",2019-08-06T00:37:10.000Z,C886VAG+7-K9#CISCO886VAG+7-K9,C886VAG+7-K9
USEB,C886VAG+7-K9#CISCO886VAG+7-K9,1389027600,FCZ160490BD,0,39,€êÌ¬n led cho cÌÁc port m‡Èù,2019-08-06T00:37:10.000Z,C886VAG+7-K9#CISCO886VAG+7-K9,C886VAG+7-K9
USEB,CISCO886VA-SEC-K9,1389027600,FCZ1627C1DN,1,39,"WH by Long,",2019-08-06T00:06:04.000Z,CISCO886VA-SEC-K9,CISCO886VA-SEC-K9
USEB,CISCO886VA-SEC-K9,1389027600,FCZ1619C3W8,1,39,"WH by Long,",2019-08-06T00:06:04.000Z,CISCO886VA-SEC-K9,CISCO886VA-SEC-K9
USEB,CISCO888E-K9,1389027600,FGL164623ZT,0,39,Model Note:V03,2019-08-06T05:03:47.000Z,CISCO888E-K9#CISCO888E-K9 ,CISCO888E-K9
USEB,AIR-CAP3502I-ABULK#AIR-CAP3502I-A-K9,1389027600,FTX1509E4KK,0,39,osi hardware,2019-08-06T00:37:10.000Z,AIR-CAP3502I-ABULK#AIR-CAP3502I-A-K9,AIR-CAP3502I-ABULK
USEB,AIR-LAP1142-NBULK#AIR-LAP1142N-N-K9,1389027600,FGL1512S1R6,0,39,osi hardware,2019-08-06T00:37:10.000Z,AIR-LAP1142-NBULK#AIR-LAP1142N-N-K9,AIR-LAP1142-NBULK
USEC,AIR-CAP3502I-N-K9,1389027600,FGL1446S0FQ,0,39,"Faded serial #, for local only",2019-08-06T00:06:04.000Z,AIR-CAP3502I-N-K9,AIR-CAP3502I-N-K9
USEB,AIR-AP1242AG-N-K9,1389027600,FTX1223B0L9,0,39,Old WLC configuration exists,2019-08-06T00:06:05.000Z,AIR-AP1242AG-N-K9,AIR-AP1242AG-N-K9
USEB,AIR-AP1242AG-N-K9,1389027600,FTX12157034,0,39,Old WLC configuration exists,2019-08-06T00:06:05.000Z,AIR-AP1242AG-N-K9,AIR-AP1242AG-N-K9
USEB,AIR-LAP1252AG-A-K9,1389027600,FTX124390Q2,0,39,osi hardware,2019-08-06T00:06:05.000Z,AIR-LAP1252AG-A-K9,AIR-LAP1252AG-A-K9
USEB,CISCO1803W-AG-A/K9,1389027600,FTX1051Z1KT,1,39,"8.1.10.1.A; 02/09/2019
",2019-09-02T01:10:15.000Z,CISCO1803W-AG-A/K9,CISCO1803W-AG-A/K9
USEC,CISCO1811W-AG-A/K9,1389027600,FTX0942Z02D,0,39,"Wifi card revomed, No face plate",2019-08-06T01:57:10.000Z,CISCO1811W-AG-A/K9,CISCO1811W-AG-A/K9
USEC,CISCO1801W-AG-E/K9,1389027600,FCZ104721G2,0,39,No face plate,2019-08-06T01:57:10.000Z,CISCO1801W-AG-E/K9,CISCO1801W-AG-E/K9
USEC,CISCO1812/K9,1389027600,FHK143278UJ,0,39,many scratches on the top cover,2019-08-06T01:57:10.000Z,CISCO1812/K9,CISCO1812/K9
USEB,CISCO1812/K9,1389027600,FHK12192A96,0,39,"password protection, unable to remove",2019-08-06T01:57:10.000Z,CISCO1812/K9,CISCO1812/K9
USEC,CISCO1811/K9,1389027600,FHK101850WR,0,39,many scratches on the top,2019-08-06T01:57:10.000Z,CISCO1811/K9,CISCO1811/K9
USEC,CISCO1941-SEC/K9,1389027600,FGL154124WM,0,39,Missing PSU,2019-08-06T00:06:05.000Z,CISCO1941-SEC/K9,CISCO1941-SEC/K9
USEB,CISCO1941-SEC/K9,1389027600,FHK143370M5,0,39,"For testing, shouldn't be sold",2019-08-06T00:06:05.000Z,CISCO1941-SEC/K9,CISCO1941-SEC/K9
USEB,CISCO1941-SEC/K9,1389027600,FGL164624D5,0,39,POE PSU,2019-08-06T01:57:10.000Z,CISCO1941-SEC/K9,CISCO1941-SEC/K9
USEB,CISCO1941-SEC/K9,1389027600,FGL170912RC,0,39,POE PSU,2019-08-06T01:57:10.000Z,CISCO1941-SEC/K9,CISCO1941-SEC/K9
USEB,CISCO1941-SEC/K9,1389027600,FGL1642142U,0,39,POE PSU,2019-08-06T01:57:10.000Z,CISCO1941-SEC/K9,CISCO1941-SEC/K9
USEB,CISCO1941-SEC/K9,1389027600,FGL170720BZ,0,39,POE PSU,2019-08-06T01:57:10.000Z,CISCO1941-SEC/K9,CISCO1941-SEC/K9
USEC,CISCO1941-SEC/K9,1389027600,FGL163710V2,0,39,"No Fan cover, Local only",2019-08-06T00:06:05.000Z,CISCO1941-SEC/K9,CISCO1941-SEC/K9
USEB,CISCO1921DC/K9#CISCO1921/K9,1389027600,FCZ1648608E,0,39,"VDC power cable,
No Face,
WH by Long,",2019-08-06T00:37:10.000Z,CISCO1921DC/K9#CISCO1921/K9,CISCO1921DC/K9
USEB,CISCO1841-SEC/K9#CISCO1841,1389027600,FHK12482AB5,0,39,"WH by Long,",2019-08-06T00:37:10.000Z,CISCO1841-SEC/K9#CISCO1841,CISCO1841-SEC/K9
USEC,CISCO1841,1389027600,FHK100521AV,0,39,Broken Ejector,2019-08-06T01:57:10.000Z,CISCO1841,CISCO1841
USEB,PA-2CE1/PRI-120,1389114000,14318699,1,39,"WH by Trung,

IPS008544
Small Rack - Middle Middle",2019-08-06T00:06:05.000Z,PA-2CE1/PRI-120,PA-2CE1/PRI-120
USEC,C3KX-NM-1G=,1389114000,FDO152201LT,1,39,"Face Damaged,
WH by Long,",2019-08-06T00:06:05.000Z,C3KX-NM-1G,C3KX-NM-1G
USEC,NM-16A#RMA,1389114000,21438529,0,39,"M‡?át tr®¡‡È?c x‡?´u
Return from CablesAndKits",2019-08-06T00:06:05.000Z,NM-16A#RMA,NM-16A
USEB,NM-1CE1T1-PRI,1389114000,FOC10021Z1R,1,39,osi hardware,2019-08-06T00:06:05.000Z,NM-1CE1T1-PRI,NM-1CE1T1-PRI
USEB,NM-1CE1T1-PRI,1389114000,FOC10080QUM,0,39,osi hardware,2019-08-06T00:06:05.000Z,NM-1CE1T1-PRI,NM-1CE1T1-PRI
USEB,NM-1CE1T1-PRI,1389114000,FOC10064DW6,1,39,"8.MD.BOX.2; 30/09/2019
",2019-09-30T02:08:11.000Z,NM-1CE1T1-PRI,NM-1CE1T1-PRI
USEB,NM-16ESW-PWR-1GIG,1389114000,JAD064807F2,1,39,M‡?át tr®¡‡È?c x‡?´u,2019-08-06T00:06:05.000Z,NM-16ESW-PWR-1GIG,NM-16ESW-PWR-1GIG
USEB,CISCO851W-G-A-K9,1389114000,FHK112110R5,0,39,Wh by Trung,2019-08-06T00:06:05.000Z,CISCO851W-G-A-K9,CISCO851W-G-A-K9
USEB,CISCO878-SEC-K9,1389114000,FHK101920K2,1,39,Wh by Trung,2019-08-06T00:06:05.000Z,CISCO878-SEC-K9,CISCO878-SEC-K9
USEB,CISCO878-SEC-K9,1389114000,FHK092712SF,1,39,Wh by Trung,2019-08-06T00:06:05.000Z,CISCO878-SEC-K9,CISCO878-SEC-K9
USEB,CISCO878-SEC-K9,1389114000,FHK115024VH,1,39,Wh by Trung,2019-08-06T00:06:05.000Z,CISCO878-SEC-K9,CISCO878-SEC-K9
USEB,CISCO878-SEC-K9,1389114000,FHK110711F7,1,39,Wh by Trung,2019-08-06T00:06:05.000Z,CISCO878-SEC-K9,CISCO878-SEC-K9
USEB,CISCO878-SEC-K9,1389114000,FHK122126TV,1,39,Wh by Trung,2019-08-06T00:06:05.000Z,CISCO878-SEC-K9,CISCO878-SEC-K9
USEB,CISCO878W-G-E-K9,1389114000,FCZ1420C105,1,39,Wh by Trung,2019-08-06T00:06:05.000Z,CISCO878W-G-E-K9,CISCO878W-G-E-K9
USEB,CISCO878W-G-A-K9,1389114000,FHK09463058,1,39,Wh by Trung,2019-08-06T00:06:06.000Z,CISCO878W-G-A-K9,CISCO878W-G-A-K9
USEB,CISCO878W-G-A-K9,1389114000,FHK101121A3,1,39,Wh by Trung,2019-08-06T00:06:06.000Z,CISCO878W-G-A-K9,CISCO878W-G-A-K9
USEB,CISCO876-SEC-I-K9,1389114000,FHK1039119N,1,39,Wh by Trung,2019-08-06T00:06:06.000Z,CISCO876-SEC-I-K9,CISCO876-SEC-I-K9
USEB,CISCO3845-V/K9#CISCO3845,1389114000,FHK1006F1DM,0,39,"Damaged, for parts only",2019-08-06T00:37:10.000Z,CISCO3845-V/K9#CISCO3845,CISCO3845-V/K9
USEB,C2821-VSEC-CCME/K9#CISCO2821-VSEC-CCME/K9,1389114000,FTX1332AHS0,0,39,osi hardware,2019-08-06T01:57:10.000Z,C2821-VSEC-CCME/K9#CISCO2821-VSEC-CCME/K9,C2821-VSEC-CCME/K9
USEB,C2821-VSEC-CCME/K9#CISCO2821-VSEC-CCME/K9,1389114000,FTX1239A5XX,0,39,osi hardware,2019-08-06T01:57:10.000Z,C2821-VSEC-CCME/K9#CISCO2821-VSEC-CCME/K9,C2821-VSEC-CCME/K9
USEB,C2821-VSEC-CCME/K9#CISCO2821-VSEC-CCME/K9,1389114000,FTX1240A2GV,0,39,osi hardware,2019-08-06T01:57:10.000Z,C2821-VSEC-CCME/K9#CISCO2821-VSEC-CCME/K9,C2821-VSEC-CCME/K9
USEB,C2821-VSEC-CCME/K9#CISCO2821-VSEC-CCME/K9,1389114000,FTX1212A3SY,0,39,osi hardware,2019-08-06T00:37:10.000Z,C2821-VSEC-CCME/K9#CISCO2821-VSEC-CCME/K9,C2821-VSEC-CCME/K9
USEB,C2821-VSEC-SRST/K9#CISCO2821-VSEC-SRST/K9,1389114000,FTX1218A0LN,0,39,osi hardware,2019-08-06T01:57:10.000Z,C2821-VSEC-SRST/K9#CISCO2821-VSEC-SRST/K9,C2821-VSEC-SRST/K9
USEB,WS-C2960-8TC-L,1389114000,FOC1332V4B4,0,39,Model Note:V01,2019-08-06T05:03:47.000Z,WS-C2960-8TC-L#WS-C2960-8TC-L ,WS-C2960-8TC-L
USEB,WS-C2960-8TC-S,1389114000,FOC1501V3TX,0,39,Model Note:V03,2019-08-06T05:03:47.000Z,WS-C2960-8TC-S#WS-C2960-8TC-S ,WS-C2960-8TC-S
USEB,WS-C2960-8TC-S,1389114000,FOC1501V3MT,0,39,Model Note:V03,2019-08-06T05:03:47.000Z,WS-C2960-8TC-S#WS-C2960-8TC-S ,WS-C2960-8TC-S
USEB,AIR-LAP1252AG-N-K9#AIR-LAP-1252AG-N-K9,1389114000,FCW1416Z0KG,0,39,osi hardware,2019-08-06T00:37:10.000Z,AIR-LAP1252AG-N-K9#AIR-LAP-1252AG-N-K9,AIR-LAP1252AG-N-K9
USEC,ASA5520-BUN-K9,1388941200,JMX1244L2T9,0,39,No Face,2019-08-06T00:06:06.000Z,ASA5520-BUN-K9,ASA5520-BUN-K9
USEC,ASA5520-BUN-K9#ASA5520 ,1388941200,JMX1244L2T8,0,39,Broken Ejector,2019-08-06T00:37:10.000Z,ASA5520-BUN-K9#ASA5520 ,ASA5520-BUN-K9
USEB,WS-C2960G-8TC-L,1388941200,FOC1410V0PH,0,39,Model Note:V02,2019-08-06T05:03:47.000Z,WS-C2960G-8TC-L#WS-C2960G-8TC-L ,WS-C2960G-8TC-L
USEB,DS-C9124-K9,1389200400,JAB1146NK59,0,39,"WH by Long,
fc1/1 - 24: activation acquired,",2019-08-06T00:06:06.000Z,DS-C9124-K9,DS-C9124-K9
USEB,EHWIC-VA-DSL-A,1389286800,FOC16181AXH,0,39,Model Note:V01,2019-08-06T05:03:47.000Z,EHWIC-VA-DSL-A#EHWIC-VA-DSL-A ,EHWIC-VA-DSL-A
USEB,HWIC-D-9ESW#HWICD-9ESW,1389286800,FOC114652CS,0,39,WH by Long,2019-08-06T00:37:10.000Z,HWIC-D-9ESW#HWICD-9ESW,HWIC-D-9ESW
USEB,HWIC-D-9ESW#HWICD-9ESW,1389286800,FOC16082JUK,0,39,"WH by Long,",2019-08-06T00:37:10.000Z,HWIC-D-9ESW#HWICD-9ESW,HWIC-D-9ESW
USEB,HWIC-D-9ESW-POE#HWICD-9ESW,1389286800,FOC11450CBE,0,39,"WH by Long,",2019-08-06T00:37:10.000Z,HWIC-D-9ESW-POE#HWICD-9ESW,HWIC-D-9ESW-POE
USEB,HWIC-D-9ESW-POE#HWICD-9ESW,1389286800,FOC12044LRH,1,39,"8.MD.BOX.5; 08/10/2019
",2019-10-08T05:05:24.000Z,HWIC-D-9ESW-POE#HWICD-9ESW,HWIC-D-9ESW-POE
USEB,HWIC-D-9ESW#HWICD-9ESW,1389286800,FOC14355D25,0,39,"WH by Long,",2019-08-06T00:37:10.000Z,HWIC-D-9ESW#HWICD-9ESW,HWIC-D-9ESW
USEB,HWIC-D-9ESW-POE#HWICD-9ESW,1389286800,FOC114430F4,1,39,"8.MD.BOX.5; 08/10/2019
",2019-10-08T05:05:23.000Z,HWIC-D-9ESW-POE#HWICD-9ESW,HWIC-D-9ESW-POE
USEB,EHWIC-3G-HSPA+7,1389373200,FOC164938EL,0,39,"WH by Long,",2019-08-06T00:06:12.000Z,EHWIC-3G-HSPA+7,EHWIC-3G-HSPA+7
USEB,EHWIC-3G-HSPA+7,1389373200,FOC16523DJK,0,39,"WH by Long,",2019-08-06T00:06:12.000Z,EHWIC-3G-HSPA+7,EHWIC-3G-HSPA+7
USEB,EHWIC-3G-HSPA+7,1389373200,FOC162705J8,0,39,"WH by Long,",2019-08-06T00:06:12.000Z,EHWIC-3G-HSPA+7,EHWIC-3G-HSPA+7
USEB,EHWIC-3G-HSPA+7,1389373200,FOC164938L9,0,39,"WH by Long,",2019-08-06T00:06:12.000Z,EHWIC-3G-HSPA+7,EHWIC-3G-HSPA+7
USEB,EHWIC-3G-HSPA+7,1389373200,FOC16523DL7,0,39,"WH by Long,",2019-08-06T00:06:12.000Z,EHWIC-3G-HSPA+7,EHWIC-3G-HSPA+7
USEB,EHWIC-3G-HSPA+7,1389373200,FOC16114B8Q,0,39,"WH by Long,",2019-08-06T00:06:12.000Z,EHWIC-3G-HSPA+7,EHWIC-3G-HSPA+7
USEB,EHWIC-3G-HSPA+7,1389373200,FOC15514QW6,0,39,"WH by Long,",2019-08-06T00:06:12.000Z,EHWIC-3G-HSPA+7,EHWIC-3G-HSPA+7
USEB,HWIC-3G-CDMA-S,1389373200,FOC13210KK9,1,39,"8.MD.BOX.35; 19/09/2019
",2019-09-19T00:48:13.000Z,HWIC-3G-CDMA-S,HWIC-3G-CDMA-S
USEB,HWIC-3G-HSPA-G,1389373200,FOC15095WVB,0,39,Model Note:V01,2019-08-06T05:03:47.000Z,HWIC-3G-HSPA-G#HWIC-3G-HSPA-G ,HWIC-3G-HSPA-G
USEB,EHWIC-3G-HSPA-U,1389373200,FOC164159E2,0,39,Model Note:V01,2019-08-06T05:03:47.000Z,EHWIC-3G-HSPA-U#EHWIC-3G-HSPA-U ,EHWIC-3G-HSPA-U
USEC,CP-7961G,1389373200,FCH11428SMC,0,39,"Scatch LCD, Local sale only",2019-08-06T00:06:12.000Z,CP-7961G,CP-7961G
USEC,CP-7945G,1389373200,FCH13198HMT,0,39,"MÌÊn hÌÂnh b‡ÈÜ r‡ÈÉ cÌ¢y nh‡??, Local sales only",2019-08-06T00:06:12.000Z,CP-7945G,CP-7945G
USEC,CP-7945G,1389373200,FCH1317902C,0,39,"Man hinh co re cay, For Lab only",2019-08-06T00:06:12.000Z,CP-7945G,CP-7945G
NOB,CP-7940=,1389373200,INM0528A0SU,1,39,"8.3.1.3.A; 11/05/2020
",2020-05-11T01:07:03.000Z,CP-7940,CP-7940
USEA,CP-7940#CP-7910+SW,1389373200,INM0520B0JB,1,39,"8.3.1.3.B; 11/05/2020
",2020-05-11T01:51:51.000Z,CP-7940#CP-7910+SW,CP-7940
USEB,VWIC3-2MFT-T1/E1,1389373200,FOC17333C6P,0,39,Model Note:V01,2019-08-06T05:03:47.000Z,VWIC3-2MFT-T1/E1#VWIC3-2MFT-T1/E1 ,VWIC3-2MFT-T1/E1
USEB,WS-X4748-RJ45V+E,1389373200,CAT1547L02L,0,39,Model Note:V02,2019-08-06T05:03:47.000Z,WS-X4748-RJ45V+E#WS-X4748-RJ45V+E ,WS-X4748-RJ45V+E
USEB,VWIC-1MFT-G703,1389373200,33124481,1,39,"8.md.box.33; 18/09/2019
",2019-09-18T04:24:59.000Z,VWIC-1MFT-G703,VWIC-1MFT-G703
USEB,VWIC-1MFT-G703,1389373200,26697089,1,39,"8.md.box.33; 18/09/2019
",2019-09-18T04:24:57.000Z,VWIC-1MFT-G703,VWIC-1MFT-G703
USEB,VWIC-1MFT-G703,1389373200,20582070,1,39,"8.md.box.33; 18/09/2019
",2019-09-18T04:24:53.000Z,VWIC-1MFT-G703,VWIC-1MFT-G703
USEB,VWIC-1MFT-G703,1389373200,31401115,1,39,"8.md.box.33; 18/09/2019
",2019-09-18T04:24:59.000Z,VWIC-1MFT-G703,VWIC-1MFT-G703
USEB,VWIC-1MFT-G703,1389373200,35893006,1,39,"8.md.box.33; 18/09/2019
",2019-09-18T04:24:58.000Z,VWIC-1MFT-G703,VWIC-1MFT-G703
USEB,VWIC-1MFT-G703,1389373200,35109418,0,39,"WH by Long,",2019-08-06T00:06:13.000Z,VWIC-1MFT-G703,VWIC-1MFT-G703
USEB,VWIC-1MFT-G703,1389373200,33041484,1,39,"8.md.box.33; 18/09/2019
",2019-09-18T04:24:59.000Z,VWIC-1MFT-G703,VWIC-1MFT-G703
USEB,VWIC-1MFT-G703,1389373200,35025376,1,39,"8.md.box.33; 18/09/2019
",2019-09-18T04:24:57.000Z,VWIC-1MFT-G703,VWIC-1MFT-G703
USEB,HWIC-8A/S-232,1389373200,FOC1342497E,0,39,Model Note:V01,2019-08-06T05:03:47.000Z,HWIC-8A/S-232#HWIC-8A/S-232 ,HWIC-8A/S-232
USEB,AIM-VPN/SSL-3,1389546000,FOC12170UGF,0,39,Model Note:V01,2019-08-06T05:03:47.000Z,AIM-VPN/SSL-3#AIM-VPN/SSL-3 ,AIM-VPN/SSL-3
USEB,AIM-VPN/SSL-3,1389546000,FOC12414GVR,0,39,Model Note:V01,2019-08-06T05:03:47.000Z,AIM-VPN/SSL-3#AIM-VPN/SSL-3 ,AIM-VPN/SSL-3
USEB,AIM-VPN/SSL-3,1389546000,FOC12233RD3,0,39,Model Note:V01,2019-08-06T05:03:47.000Z,AIM-VPN/SSL-3#AIM-VPN/SSL-3 ,AIM-VPN/SSL-3
USEB,AIM-VPN/SSL-3,1389546000,FOC12324X4P,0,39,Model Note:V01,2019-08-06T05:03:47.000Z,AIM-VPN/SSL-3#AIM-VPN/SSL-3 ,AIM-VPN/SSL-3
USEB,AIM-VPN/SSL-3,1389546000,FOC11445SV4,0,39,Model Note:V01,2019-08-06T05:03:47.000Z,AIM-VPN/SSL-3#AIM-VPN/SSL-3 ,AIM-VPN/SSL-3
USEC,AIM-ATM#DAUGHTER CARD OF AIM-ATM,1389546000,JAE08050K2G,0,39,For Local only,2019-08-06T00:37:11.000Z,AIM-ATM#DAUGHTER CARD OF AIM-ATM,AIM-ATM
USEC,WIC-1ADSL,1389546000,FOC10131JZ9,0,39,"Broken Component,
WH by Long,",2019-08-06T00:06:13.000Z,WIC-1ADSL,WIC-1ADSL
USEB,VIC-2BRI-NT/TE#VIC-2B-NT/TE,1389546000,27244663,0,39,"WH by Long,",2019-08-06T00:37:11.000Z,VIC-2BRI-NT/TE#VIC-2B-NT/TE,VIC-2BRI-NT/TE
USEB,VIC-2BRI-NT/TE#VIC-2B-NT/TE,1389546000,32690700,0,39,"WH by Long,",2019-08-06T00:37:11.000Z,VIC-2BRI-NT/TE#VIC-2B-NT/TE,VIC-2BRI-NT/TE
USEB,VIC-2BRI-NT/TE#VIC-2B-NT/TE,1389546000,28739957,0,39,"WH by Long,",2019-08-06T00:37:11.000Z,VIC-2BRI-NT/TE#VIC-2B-NT/TE,VIC-2BRI-NT/TE
USEB,WS-X45-SUP6L-E,1389546000,JAE1515066N,0,39,Model Note:V05,2019-08-06T05:03:47.000Z,WS-X45-SUP6L-E#WS-X45-SUP6L-E ,WS-X45-SUP6L-E
USEB,WS-X45-SUP6L-E/2#WS-X45-SUP6L-E ,1389546000,JAE154504LZ,0,39,Model Note:V05,2019-08-06T00:37:11.000Z,WS-X45-SUP6L-E/2#WS-X45-SUP6L-E ,WS-X45-SUP6L-E/2
USEB,WS-X45-SUP6L-E,1389546000,JAE154504IE,0,39,Model Note:V05,2019-08-06T05:03:47.000Z,WS-X45-SUP6L-E#WS-X45-SUP6L-E ,WS-X45-SUP6L-E
USEB,WS-X45-SUP7-E,1389546000,CAT1603L2MD,0,39,Model Note:V03,2019-08-06T05:03:47.000Z,WS-X45-SUP7-E#WS-X45-SUP7-E ,WS-X45-SUP7-E
USEB,CISCO877W-G-A-K9,1389632400,FHK113211TG,0,39,Wh by Trung,2019-08-06T00:06:13.000Z,CISCO877W-G-A-K9,CISCO877W-G-A-K9
NOB,C3KX-PWR-715WAC=,1389632400,DCB1717A2KE,0,39,"WH,",2019-08-06T00:06:13.000Z,C3KX-PWR-715WAC,C3KX-PWR-715WAC
USEB,CISCO881G-K9,1389546000,FCZ131192M0,0,39,Model Note:V01,2019-08-06T05:03:47.000Z,CISCO881G-K9#CISCO881G-K9 ,CISCO881G-K9
USEB,CISCO881G-K9,1389546000,FCZ1333C1P0,0,39,Model Note:V01,2019-08-06T05:03:47.000Z,CISCO881G-K9#CISCO881G-K9 ,CISCO881G-K9
USEB,CISCO881G-K9,1389546000,FCZ1333C1PT,0,39,Model Note:V01,2019-08-06T05:03:47.000Z,CISCO881G-K9#CISCO881G-K9 ,CISCO881G-K9
USEB,CISCO881G-K9,1389546000,FCZ1333C1PJ,0,39,Model Note:V01,2019-08-06T05:03:47.000Z,CISCO881G-K9#CISCO881G-K9 ,CISCO881G-K9
USEB,CISCO881G-G-K9#CISCO881G-K9 ,1389546000,FCZ135190P4,0,39,Model Note:V01,2019-08-06T00:37:11.000Z,CISCO881G-G-K9#CISCO881G-K9 ,CISCO881G-G-K9
USEC,WS-C2960-24TT-L,1389546000,FOC1112X0LZ,0,39,"f0/13 faulty, Mode button damaged, No PSU
WH by Long",2019-08-06T00:06:14.000Z,WS-C2960-24TT-L,WS-C2960-24TT-L
USEB,CISCO881W-GN-A-K9,1389546000,FTX1428804G,0,39,Model Note:V01,2019-08-06T05:03:47.000Z,CISCO881W-GN-A-K9#CISCO881W-GN-A-K9 ,CISCO881W-GN-A-K9
USEB,WS-X6704-10GE#WS-X6704-10GE-3BXL,1390150800,SAL083536MC,0,39,osi hardware,2019-08-06T00:37:11.000Z,WS-X6704-10GE#WS-X6704-10GE-3BXL,WS-X6704-10GE
USEB,CISCO3845-V/K9#CISCO3845 ,1390150800,FHK1006F1G6,0,39,Model Note:V01,2019-08-06T00:37:11.000Z,CISCO3845-V/K9#CISCO3845 ,CISCO3845-V/K9
USEB,CISCO3845-V/K9#CISCO3845 ,1390150800,FHK1006F1E0,0,39,Model Note:V01,2019-08-06T00:37:11.000Z,CISCO3845-V/K9#CISCO3845 ,CISCO3845-V/K9
USEB,WS-C3750G-12S-S,1390150800,FDO1145Z55C,0,39,Model Note:V06,2019-08-06T05:03:47.000Z,WS-C3750G-12S-S#WS-C3750G-12S-S ,WS-C3750G-12S-S
USEB,CISCO881W-GN-A-K9,1390150800,FTX154683UU,0,39,Model Note:V03,2019-08-06T05:03:47.000Z,CISCO881W-GN-A-K9#CISCO881W-GN-A-K9 ,CISCO881W-GN-A-K9
USEB,WS-C2960-48TC-L#WS C2960-48TC-L,1390150800,FOC1002X1HB,0,39,osi hardware,2019-08-06T00:37:11.000Z,WS-C2960-48TC-L#WS C2960-48TC-L,WS-C2960-48TC-L
USEB,WS-C2960-48TC-L#WS C2960-48TC-L,1390150800,FOC1002X1HN,0,39,osi hardware,2019-08-06T00:37:11.000Z,WS-C2960-48TC-L#WS C2960-48TC-L,WS-C2960-48TC-L
USEB,EHWIC-D-8ESG,1390150800,FOC17023NJ6,0,39,Model Note:V01,2019-08-06T05:03:47.000Z,EHWIC-D-8ESG#EHWIC-D-8ESG ,EHWIC-D-8ESG
USEB,CISCO1941-SEC/K9#CISCO1941/K9 ,1390150800,FGL1622102B,0,39,Model Note:V04,2019-08-06T00:37:11.000Z,CISCO1941-SEC/K9#CISCO1941/K9 ,CISCO1941-SEC/K9
USEB,CISCO857W-G-A-K9,1390150800,FHK1246244A,0,39,Model Note:V05,2019-08-06T05:03:47.000Z,CISCO857W-G-A-K9#CISCO857W-G-A-K9 ,CISCO857W-G-A-K9
USEB,CISCO3845-SAA/K9#CISCO3845 ,1390150800,FHK1051F05C,0,39,Model Note:V01,2019-08-06T00:37:11.000Z,CISCO3845-SAA/K9#CISCO3845 ,CISCO3845-SAA/K9
NIB,GLC-LH-SMD=,1390150800,FNS17211B90,0,39,osi hardware,2019-08-06T00:06:19.000Z,GLC-LH-SMD,GLC-LH-SMD
NIB,GLC-LH-SMD=,1390150800,FNS17211558,0,39,osi hardware,2019-08-06T00:06:19.000Z,GLC-LH-SMD,GLC-LH-SMD
NIB,GLC-LH-SMD=,1390150800,FNS17211L15,0,39,osi hardware,2019-08-06T00:06:19.000Z,GLC-LH-SMD,GLC-LH-SMD
NIB,GLC-LH-SMD=,1390150800,SPC172206CQ,0,39,osi hardware,2019-08-06T00:06:19.000Z,GLC-LH-SMD,GLC-LH-SMD
NIB,GLC-LH-SMD=,1390150800,FNS1721154H,0,39,osi hardware,2019-08-06T00:06:19.000Z,GLC-LH-SMD,GLC-LH-SMD
NIB,GLC-LH-SMD=,1390150800,FNS1721154C,0,39,osi hardware,2019-08-06T00:06:19.000Z,GLC-LH-SMD,GLC-LH-SMD
NIB,GLC-LH-SMD=,1390150800,FNS17211EVS,0,39,osi hardware,2019-08-06T00:06:19.000Z,GLC-LH-SMD,GLC-LH-SMD
NIB,GLC-LH-SMD=,1390150800,SPC172208Z1,0,39,osi hardware,2019-08-06T00:06:19.000Z,GLC-LH-SMD,GLC-LH-SMD
NIB,GLC-LH-SMD=,1390150800,FNS17211K77,0,39,osi hardware,2019-08-06T00:06:19.000Z,GLC-LH-SMD,GLC-LH-SMD
NIB,GLC-LH-SMD=,1390150800,SPC1722068A,0,39,osi hardware,2019-08-06T00:06:19.000Z,GLC-LH-SMD,GLC-LH-SMD
NIB,GLC-LH-SMD=,1390150800,FNS17211M24,0,39,osi hardware,2019-08-06T00:06:19.000Z,GLC-LH-SMD,GLC-LH-SMD
USEB,CISCO1801,1390323600,FHK103351XE,0,39,Model Note:V01,2019-08-06T05:03:47.000Z,CISCO1801#CISCO1801 ,CISCO1801
USEB,CISCO1801,1390323600,FHK1035H3WG,0,39,Model Note:V01,2019-08-06T05:03:47.000Z,CISCO1801#CISCO1801 ,CISCO1801
USEB,CISCO1801,1390323600,FHK1146F1HU,0,39,Model Note:V01,2019-08-06T05:03:47.000Z,CISCO1801#CISCO1801 ,CISCO1801
USEB,NM-4T,1390323600,26227924,1,39,"8.BOX.0020; 10/09/2019
",2019-09-09T23:49:51.000Z,NM-4T,NM-4T
USEB,NM-4T,1390323600,22783732,1,39,"8.BOX.0020; 10/09/2019
",2019-09-09T23:49:50.000Z,NM-4T,NM-4T
USEB,NM-4T,1390323600,21484431,1,39,"8.BOX.0020; 10/09/2019
",2019-09-09T23:49:49.000Z,NM-4T,NM-4T
USEB,NM-4T,1390323600,21484976,1,39,"8.BOX.0020; 10/09/2019
",2019-09-09T23:49:50.000Z,NM-4T,NM-4T
USEB,NM-4T,1390323600,22740297,1,39,"8.BOX.0020; 10/09/2019
",2019-09-09T23:49:50.000Z,NM-4T,NM-4T
USEB,NM-4T,1390323600,26352688,1,39,"8.BOX.0020; 10/09/2019
",2019-09-09T23:49:49.000Z,NM-4T,NM-4T
USEB,NM-4T,1390323600,26335288,1,39,"8.BOX.0020; 10/09/2019
",2019-09-09T23:49:49.000Z,NM-4T,NM-4T
USEB,NM-4T,1390323600,26337033,1,39,"8.BOX.0020; 10/09/2019
",2019-09-09T23:49:50.000Z,NM-4T,NM-4T
USEB,NM-4T,1390323600,26294756,1,39,"8.BOX.0020; 10/09/2019
",2019-09-09T23:49:50.000Z,NM-4T,NM-4T
USEB,NM-4T,1390323600,24408447,1,39,"8.BOX.0020; 10/09/2019
",2019-09-09T23:49:50.000Z,NM-4T,NM-4T
USEB,NM-4T,1390323600,24405363,1,39,"8.BOX.0020; 10/09/2019
",2019-09-09T23:49:49.000Z,NM-4T,NM-4T
USEB,CISCO877W-G-E-M-K9,1390755600,FCZ122661Q1,0,39,Wh by Trung,2019-08-06T00:06:19.000Z,CISCO877W-G-E-M-K9,CISCO877W-G-E-M-K9
USEB,WS-C2960S-24PS-L,1390755600,FOC1623Z2L0,0,39,Model Note:V03,2019-08-06T05:03:47.000Z,WS-C2960S-24PS-L#WS-C2960S-24PS-L ,WS-C2960S-24PS-L
USEB,CISCO1801/K9#CISCO1801 ,1390755600,FHK1231F0WF,0,39,Model Note:V04,2019-08-06T00:37:11.000Z,CISCO1801/K9#CISCO1801 ,CISCO1801/K9
USEC,WS-C3750G-24T-E,1390755600,CAT1042ZH5T,0,39,"Broken Mode Button,
Cannot find in WH,",2019-08-06T00:06:19.000Z,WS-C3750G-24T-E,WS-C3750G-24T-E
USEB,WS-C3750G-24T-E,1390755600,CAT0908Y1L9,0,39,Model Note:V05,2019-08-06T05:03:47.000Z,WS-C3750G-24T-E#WS-C3750G-24T-E ,WS-C3750G-24T-E
USEB,CISCO1801,1390755600,FHK10341610,0,39,Model Note:V01,2019-08-06T05:03:47.000Z,CISCO1801#CISCO1801 ,CISCO1801
USEB,WS-C3750G-24TS-S1U,1390755600,FOC1409Z2NG,0,39,Model Note:V03,2019-08-06T05:03:47.000Z,WS-C3750G-24TS-S1U#WS-C3750G-24TS-S1U ,WS-C3750G-24TS-S1U
USEB,WS-C2960S-48TS-L,1390755600,FOC1537W5TH,0,39,Model Note:V04,2019-08-06T05:03:47.000Z,WS-C2960S-48TS-L#WS-C2960S-48TS-L ,WS-C2960S-48TS-L
USEB,WS-C2960S-48TS-L,1390755600,FOC1537Z0P4,0,39,Model Note:V04,2019-08-06T05:03:47.000Z,WS-C2960S-48TS-L#WS-C2960S-48TS-L ,WS-C2960S-48TS-L
USEB,WS-C2960-24TC-L,1390755600,FOC1140W0RL,0,39,Model Note:V03,2019-08-06T05:03:47.000Z,WS-C2960-24TC-L#WS-C2960-24TC-L ,WS-C2960-24TC-L
USEB,WS-C2960-24TT-L,1391014800,FOC1252X2LA,0,39,Model Note:V05,2019-08-06T05:03:47.000Z,WS-C2960-24TT-L#WS-C2960-24TT-L ,WS-C2960-24TT-L
USEB,CISCO1811/K9#CISCO1811 ,1391014800,FTX1245Y0DD,0,39,Model Note:V06,2019-08-06T00:37:11.000Z,CISCO1811/K9#CISCO1811 ,CISCO1811/K9
USEB,CISCO1811/K9#CISCO1811 ,1391014800,FTX1029Y16C,0,39,Model Note:V06,2019-08-06T00:37:11.000Z,CISCO1811/K9#CISCO1811 ,CISCO1811/K9
USEB,CISCO1811/K9#CISCO1811 ,1391014800,FTX1215W038,0,39,Model Note:V06,2019-08-06T00:37:11.000Z,CISCO1811/K9#CISCO1811 ,CISCO1811/K9
USEB,CISCO1811/K9#CISCO1811 ,1391014800,FTX1245Y0CW,0,39,Model Note:V06,2019-08-06T00:37:11.000Z,CISCO1811/K9#CISCO1811 ,CISCO1811/K9
USEB,CISCO1801/K9#CISCO1801 ,1391014800,FHK11502158,0,39,Model Note:V04,2019-08-06T00:37:11.000Z,CISCO1801/K9#CISCO1801 ,CISCO1801/K9
USEB,CISCO1801/K9#CISCO1801 ,1391014800,FHK124120VM,0,39,Model Note:V04,2019-08-06T00:37:11.000Z,CISCO1801/K9#CISCO1801 ,CISCO1801/K9
USEB,WS-C3750E-24TD-S,1391014800,FDO1230V13Y,0,39,Model Note:V02,2019-08-06T05:03:47.000Z,WS-C3750E-24TD-S#WS-C3750E-24TD-S ,WS-C3750E-24TD-S
USEB,WS-C3750E-24TD-S,1391014800,FDO1230V13T,0,39,Model Note:V02,2019-08-06T05:03:47.000Z,WS-C3750E-24TD-S#WS-C3750E-24TD-S ,WS-C3750E-24TD-S
USEB,C2960S-STACK,1391014800,FOC1531621B,0,39,Model Note:V02,2019-08-06T05:03:47.000Z,C2960S-STACK#C2960S-STACK ,C2960S-STACK
USEB,WS-C2960G-8TC-L,1391014800,FOC1524W57Y,0,39,Model Note:V02,2019-08-06T05:03:48.000Z,WS-C2960G-8TC-L#WS-C2960G-8TC-L ,WS-C2960G-8TC-L
USEB,WS-C3750G-24TS-S,1391014800,CAT1124ZJNQ,0,39,Model Note:V07,2019-08-06T05:03:48.000Z,WS-C3750G-24TS-S#WS-C3750G-24TS-S ,WS-C3750G-24TS-S
USEB,CISCO1801,1391014800,FCZ1012141C,0,39,Model Note:V01,2019-08-06T05:03:48.000Z,CISCO1801#CISCO1801 ,CISCO1801
USEB,WS-C3750G-48PS-S,1391014800,FOC1006Y1HX,0,39,Model Note:V06,2019-08-06T05:03:48.000Z,WS-C3750G-48PS-S#WS-C3750G-48PS-S ,WS-C3750G-48PS-S
USEB,HWIC-3G-HSPA,1391014800,FOC14354F5F,0,39,Model Note:V02,2019-08-06T05:03:48.000Z,HWIC-3G-HSPA#HWIC-3G-HSPA ,HWIC-3G-HSPA
USEB,WS-C2960S-24PS-L,1391014800,FOC1518X2CP,0,39,Model Note:V02,2019-08-06T05:03:48.000Z,WS-C2960S-24PS-L#WS-C2960S-24PS-L ,WS-C2960S-24PS-L
USEB,WS-C2960S-24PS-L,1391014800,FOC1518Y3UY,0,39,Model Note:V02,2019-08-06T05:03:48.000Z,WS-C2960S-24PS-L#WS-C2960S-24PS-L ,WS-C2960S-24PS-L
USEB,WS-C2960S-24PS-L,1391014800,FOC1518Y3W1,0,39,Model Note:V02,2019-08-06T05:03:48.000Z,WS-C2960S-24PS-L#WS-C2960S-24PS-L ,WS-C2960S-24PS-L
USEB,WS-C2960S-24PS-L,1391014800,FOC1518Y3PS,0,39,Model Note:V02,2019-08-06T05:03:48.000Z,WS-C2960S-24PS-L#WS-C2960S-24PS-L ,WS-C2960S-24PS-L
USEB,WS-C2960G-8TC-L,1391014800,FOC1701ZKST,0,39,Model Note:V02,2019-08-06T05:03:48.000Z,WS-C2960G-8TC-L#WS-C2960G-8TC-L ,WS-C2960G-8TC-L
USEB,WS-C2960G-8TC-L,1391014800,FOC1447Y1WP,0,39,Model Note:V02,2019-08-06T05:03:48.000Z,WS-C2960G-8TC-L#WS-C2960G-8TC-L ,WS-C2960G-8TC-L
USEB,WS-C2960G-8TC-L,1391014800,FOC1701ZL4N,0,39,Model Note:V02,2019-08-06T05:03:48.000Z,WS-C2960G-8TC-L#WS-C2960G-8TC-L ,WS-C2960G-8TC-L
USEB,WS-C2960G-8TC-L,1391014800,FOC1609Z0GY,0,39,Model Note:V02,2019-08-06T05:03:48.000Z,WS-C2960G-8TC-L#WS-C2960G-8TC-L ,WS-C2960G-8TC-L
USEB,WS-C2960S-24PS-L,1391014800,FOC1542Y0UT,0,39,Model Note:V02,2019-08-06T05:03:48.000Z,WS-C2960S-24PS-L#WS-C2960S-24PS-L ,WS-C2960S-24PS-L
USEB,CISCO1801,1391014800,FHK1145F2N3,0,39,Model Note:V03,2019-08-06T05:03:48.000Z,CISCO1801#CISCO1801 ,CISCO1801
USEB,CISCO887VA-SEC-K9,1391014800,FGL163324BM,0,39,Model Note:V02,2019-08-06T05:03:48.000Z,CISCO887VA-SEC-K9#CISCO887VA-SEC-K9 ,CISCO887VA-SEC-K9
USEB,WS-C2960-24TT-L,1391014800,FOC1011X1AD,0,39,Model Note:V02,2019-08-06T05:03:48.000Z,WS-C2960-24TT-L#WS-C2960-24TT-L ,WS-C2960-24TT-L
USEB,WS-C2960-24TT-L,1391014800,FOC1011X1AJ,0,39,Model Note:V02,2019-08-06T05:03:48.000Z,WS-C2960-24TT-L#WS-C2960-24TT-L ,WS-C2960-24TT-L
PART,WS-C3550-12G,1391014800,CAT0712X24R,0,39,For Part only wh by tuan,2019-08-06T00:06:20.000Z,WS-C3550-12G,WS-C3550-12G
USEB,CISCO2851-CCME/K9#CISCO2821 ,1391014800,FHK0924F1DX,0,39,Model Note:V04,2019-08-06T00:37:11.000Z,CISCO2851-CCME/K9#CISCO2821 ,CISCO2851-CCME/K9
USEB,CISCO1803/K9#CISCO1803 ,1391014800,FCZ1118232Q,0,39,Model Note:V03,2019-08-06T00:37:11.000Z,CISCO1803/K9#CISCO1803 ,CISCO1803/K9
USEB,CISCO1803/K9#CISCO1803 ,1391014800,FCZ111974ES,0,39,Model Note:V03,2019-08-06T00:37:11.000Z,CISCO1803/K9#CISCO1803 ,CISCO1803/K9
USEB,CISCO1803/K9#CISCO1803 ,1391014800,FCZ120391Z2,0,39,Model Note:V03,2019-08-06T00:37:11.000Z,CISCO1803/K9#CISCO1803 ,CISCO1803/K9
USEB,CISCO1803/K9#CISCO1803 ,1391014800,FCZ111974EN,0,39,Model Note:V03,2019-08-06T00:37:11.000Z,CISCO1803/K9#CISCO1803 ,CISCO1803/K9
USEB,CISCO1803/K9#CISCO1803 ,1391014800,FCZ1119729B,0,39,Model Note:V03,2019-08-06T00:37:11.000Z,CISCO1803/K9#CISCO1803 ,CISCO1803/K9
USEB,CISCO1803/K9#CISCO1803 ,1391014800,FCZ111810T2,0,39,Model Note:V03,2019-08-06T00:37:11.000Z,CISCO1803/K9#CISCO1803 ,CISCO1803/K9
USEB,CISCO1801,1391014800,FCZ11011352,0,39,Model Note:V02,2019-08-06T05:03:48.000Z,CISCO1801#CISCO1801 ,CISCO1801
USEB,CISCO1801,1391014800,FCZ101612ZJ,0,39,Model Note:V02,2019-08-06T05:03:48.000Z,CISCO1801#CISCO1801 ,CISCO1801
USEB,WS-C3750G-48PS-S,1391014800,FOC1240W3XF,0,39,Model Note:V08,2019-08-06T05:03:48.000Z,WS-C3750G-48PS-S#WS-C3750G-48PS-S ,WS-C3750G-48PS-S
USEB,WS-C3750-48TS-S,1391014800,CAT0934Z2CL,0,39,Model Note:V05,2019-08-06T05:03:48.000Z,WS-C3750-48TS-S#WS-C3750-48TS-S ,WS-C3750-48TS-S
USEB,WS-C3750G-24TS-S1U,1391533200,FOC1103Y5J5,0,39,Model Note:V03,2019-08-06T05:03:48.000Z,WS-C3750G-24TS-S1U#WS-C3750G-24TS-S1U ,WS-C3750G-24TS-S1U
NOB,N2K-C2232PP-10GE,1391533200,SSI15460CPK,0,39,osi hardware,2019-08-06T00:06:20.000Z,N2K-C2232PP-10GE,N2K-C2232PP-10GE
NIB,N2K-C2232PP-10GE,1391533200,SSI15460ATE,0,39,osi hardware,2019-08-06T00:06:20.000Z,N2K-C2232PP-10GE,N2K-C2232PP-10GE
NIB,AIR-CAP3602I-NBULK#AIR-CAP3602I-N-K9,1391533200,FGL1631W11J,0,39,osi hardware,2019-08-06T00:37:11.000Z,AIR-CAP3602I-NBULK#AIR-CAP3602I-N-K9,AIR-CAP3602I-NBULK
NIB,AIR-CAP3602I-NBULK#AIR-CAP3602I-N-K9,1391533200,FGL1631W117,0,39,osi hardware,2019-08-06T00:37:11.000Z,AIR-CAP3602I-NBULK#AIR-CAP3602I-N-K9,AIR-CAP3602I-NBULK
NIB,AIR-CAP3602I-NBULK#AIR-CAP3602I-N-K9,1391533200,FGL1631W11D,0,39,osi hardware,2019-08-06T00:37:11.000Z,AIR-CAP3602I-NBULK#AIR-CAP3602I-N-K9,AIR-CAP3602I-NBULK
NIB,AIR-CAP3602I-NBULK#AIR-CAP3602I-N-K9,1391533200,FGL1631W11B,0,39,osi hardware,2019-08-06T00:37:11.000Z,AIR-CAP3602I-NBULK#AIR-CAP3602I-N-K9,AIR-CAP3602I-NBULK
NIB,AIR-CAP3602I-NBULK#AIR-CAP3602I-N-K9,1391533200,FGL1631W120,0,39,osi hardware,2019-08-06T00:37:11.000Z,AIR-CAP3602I-NBULK#AIR-CAP3602I-N-K9,AIR-CAP3602I-NBULK
NIB,AIR-CAP3602I-NBULK#AIR-CAP3602I-N-K9,1391533200,FGL1631W19K,0,39,osi hardware,2019-08-06T00:37:11.000Z,AIR-CAP3602I-NBULK#AIR-CAP3602I-N-K9,AIR-CAP3602I-NBULK
NIB,AIR-CAP3602I-NBULK#AIR-CAP3602I-N-K9,1391533200,FGL1631W11L,0,39,osi hardware,2019-08-06T00:37:11.000Z,AIR-CAP3602I-NBULK#AIR-CAP3602I-N-K9,AIR-CAP3602I-NBULK
NIB,AIR-CAP3602I-NBULK#AIR-CAP3602I-N-K9,1391533200,FGL1631W11F,0,39,osi hardware,2019-08-06T00:37:11.000Z,AIR-CAP3602I-NBULK#AIR-CAP3602I-N-K9,AIR-CAP3602I-NBULK
NIB,AIR-CAP3602I-NBULK#AIR-CAP3602I-N-K9,1391533200,FGL1631W11G,0,39,osi hardware,2019-08-06T00:37:11.000Z,AIR-CAP3602I-NBULK#AIR-CAP3602I-N-K9,AIR-CAP3602I-NBULK
NIB,AIR-CAP3602I-NBULK#AIR-CAP3602I-N-K9,1391533200,FGL1631W11E,0,39,osi hardware,2019-08-06T00:37:11.000Z,AIR-CAP3602I-NBULK#AIR-CAP3602I-N-K9,AIR-CAP3602I-NBULK
NIB,AIR-CAP3602I-NBULK#AIR-CAP3602I-N-K9,1391533200,FGL1631W130,0,39,osi hardware,2019-08-06T00:37:11.000Z,AIR-CAP3602I-NBULK#AIR-CAP3602I-N-K9,AIR-CAP3602I-NBULK
NIB,AIR-CAP3602I-NBULK#AIR-CAP3602I-N-K9,1391533200,FGL1631W114,0,39,osi hardware,2019-08-06T00:37:11.000Z,AIR-CAP3602I-NBULK#AIR-CAP3602I-N-K9,AIR-CAP3602I-NBULK
NIB,AIR-CAP3602I-NBULK#AIR-CAP3602I-N-K9,1391533200,FGL1631W135,0,39,osi hardware,2019-08-06T00:37:11.000Z,AIR-CAP3602I-NBULK#AIR-CAP3602I-N-K9,AIR-CAP3602I-NBULK
NIB,AIR-CAP3602I-NBULK#AIR-CAP3602I-N-K9,1391533200,FGL1631W136,0,39,osi hardware,2019-08-06T00:37:11.000Z,AIR-CAP3602I-NBULK#AIR-CAP3602I-N-K9,AIR-CAP3602I-NBULK
NIB,AIR-CAP3602I-NBULK#AIR-CAP3602I-N-K9,1391533200,FGL1631W132,0,39,osi hardware,2019-08-06T00:37:11.000Z,AIR-CAP3602I-NBULK#AIR-CAP3602I-N-K9,AIR-CAP3602I-NBULK
NIB,AIR-CAP3602I-NBULK#AIR-CAP3602I-N-K9,1391533200,FGL1631W12Y,0,39,osi hardware,2019-08-06T00:37:11.000Z,AIR-CAP3602I-NBULK#AIR-CAP3602I-N-K9,AIR-CAP3602I-NBULK
NIB,AIR-CAP3602I-NBULK#AIR-CAP3602I-N-K9,1391533200,FGL1631W12X,0,39,osi hardware,2019-08-06T00:37:11.000Z,AIR-CAP3602I-NBULK#AIR-CAP3602I-N-K9,AIR-CAP3602I-NBULK
NIB,AIR-CAP3602I-NBULK#AIR-CAP3602I-N-K9,1391533200,FGL1631W12U,0,39,osi hardware,2019-08-06T00:37:11.000Z,AIR-CAP3602I-NBULK#AIR-CAP3602I-N-K9,AIR-CAP3602I-NBULK
NIB,AIR-CAP3602I-NBULK#AIR-CAP3602I-N-K9,1391533200,FGL1631W112,0,39,osi hardware,2019-08-06T00:37:11.000Z,AIR-CAP3602I-NBULK#AIR-CAP3602I-N-K9,AIR-CAP3602I-NBULK
NIB,AIR-CAP3602I-NBULK#AIR-CAP3602I-N-K9,1391533200,FGL1631W12Z,0,39,osi hardware,2019-08-06T00:37:11.000Z,AIR-CAP3602I-NBULK#AIR-CAP3602I-N-K9,AIR-CAP3602I-NBULK
USEB,WS-C3750V2-24TS-S,1391619600,FDO1515X2MG,0,39,Model Note:V05,2019-08-06T05:03:48.000Z,WS-C3750V2-24TS-S#WS-C3750V2-24TS-S ,WS-C3750V2-24TS-S
USEB,WS-C3750V2-24TS-S,1391619600,FDO1515X2M7,0,39,Model Note:V05,2019-08-06T05:03:48.000Z,WS-C3750V2-24TS-S#WS-C3750V2-24TS-S ,WS-C3750V2-24TS-S
USEB,WS-C3560V2-24TS-S,1391619600,FDO1605X007,0,39,WH by Long,2019-08-06T00:06:20.000Z,WS-C3560V2-24TS-S,WS-C3560V2-24TS-S
USEB,WS-C2960-48TC-L,1391619600,FOC1413Z0FE,0,39,Model Note:V05,2019-08-06T05:03:48.000Z,WS-C2960-48TC-L#WS-C2960-48TC-L ,WS-C2960-48TC-L
USEB,WS-C2960-48TC-L,1391619600,FOC1440X03N,0,39,Model Note:V05,2019-08-06T05:03:48.000Z,WS-C2960-48TC-L#WS-C2960-48TC-L ,WS-C2960-48TC-L
USEB,WS-C3560G-48PS-S,1391619600,FOC1342Y53W,0,39,Model Note:V06,2019-08-06T05:03:48.000Z,WS-C3560G-48PS-S#WS-C3560G-48PS-S ,WS-C3560G-48PS-S
USEB,WS-C3560G-48PS-S,1391619600,FOC1349W0FV,0,39,Model Note:V06,2019-08-06T05:03:48.000Z,WS-C3560G-48PS-S#WS-C3560G-48PS-S ,WS-C3560G-48PS-S
USEB,WS-C3750E-48PD-S,1391619600,FDO1409R10F,0,39,Model Note:V03,2019-08-06T05:03:48.000Z,WS-C3750E-48PD-S#WS-C3750E-48PD-S ,WS-C3750E-48PD-S
USEB,WS-C2960G-8TC-L,1391619600,FOC1704Y4N4,0,39,Model Note:V02,2019-08-06T05:03:48.000Z,WS-C2960G-8TC-L#WS-C2960G-8TC-L ,WS-C2960G-8TC-L
USEB,WS-C2960G-8TC-L,1391619600,FOC1544Y0DZ,0,39,Model Note:V02,2019-08-06T05:03:48.000Z,WS-C2960G-8TC-L#WS-C2960G-8TC-L ,WS-C2960G-8TC-L
USEB,WS-C2960G-8TC-L,1391619600,FOC1704Y4NC,0,39,Model Note:V02,2019-08-06T05:03:48.000Z,WS-C2960G-8TC-L#WS-C2960G-8TC-L ,WS-C2960G-8TC-L
USEB,WS-C2960G-8TC-L,1391619600,FOC1705Z03G,0,39,Model Note:V02,2019-08-06T05:03:48.000Z,WS-C2960G-8TC-L#WS-C2960G-8TC-L ,WS-C2960G-8TC-L
USEB,WS-C2960G-8TC-L,1391619600,FOC1513W3YZ,0,39,Model Note:V02,2019-08-06T05:03:48.000Z,WS-C2960G-8TC-L#WS-C2960G-8TC-L ,WS-C2960G-8TC-L
USEB,ASA5505-UL-BUN-K9#ASA5505 ,1391619600,JMX1146Z0NP,0,39,Model Note:V04,2019-08-06T00:37:12.000Z,ASA5505-UL-BUN-K9#ASA5505 ,ASA5505-UL-BUN-K9
USEB,WS-C2960C-12PCL-RF#WS-C2960C-12PC-L,1391619600,FOC1635Y1ZY,0,39,Model Note:V01,2019-08-06T00:37:12.000Z,WS-C2960C-12PCL-RF#WS-C2960C-12PC-L,WS-C2960C-12PCL-RF
USEB,CISCO2901/K9,1391619600,FCZ170794D9,0,39,Model Note:V06,2019-08-06T05:03:48.000Z,CISCO2901/K9#CISCO2901/K9 ,CISCO2901/K9
USEB,WS-C3750G-24T-S,1392138000,CAT1122NJR8,0,39,Model Note:V05,2019-08-06T05:03:48.000Z,WS-C3750G-24T-S#WS-C3750G-24T-S ,WS-C3750G-24T-S
USEB,WS-C3750G-24T-S,1392138000,CAT1108NHMG,0,39,"Model Note:V05,
Cannot find in WH",2019-08-06T00:06:20.000Z,WS-C3750G-24T-S,WS-C3750G-24T-S
USEB,WS-C3750G-24T-S,1392138000,CAT1116ZJ6K,0,39,Model Note:V05,2019-08-06T05:03:48.000Z,WS-C3750G-24T-S#WS-C3750G-24T-S ,WS-C3750G-24T-S
USEB,ME-3400G-2CS-A,1392570000,FOC1235U1EA,0,39,Model Note:V03,2019-08-06T05:03:48.000Z,ME-3400G-2CS-A#ME-3400G-2CS-A ,ME-3400G-2CS-A
USEB,WS-C3750G-24T-S,1392829200,FDO1405Y1TY,0,39,Model Note:V08,2019-08-06T05:03:48.000Z,WS-C3750G-24T-S#WS-C3750G-24T-S ,WS-C3750G-24T-S
USEB,WS-C3750G-24T-S,1392829200,FDO1403Z0MA,0,39,Model Note:V08,2019-08-06T05:03:48.000Z,WS-C3750G-24T-S#WS-C3750G-24T-S ,WS-C3750G-24T-S
USEB,WS-C3750G-24T-S,1392915600,FDO1535X0PN,0,39,Model Note:V10,2019-08-06T05:03:48.000Z,WS-C3750G-24T-S#WS-C3750G-24T-S ,WS-C3750G-24T-S
NIB,NM-HDV2-2T1/E1=,1392915600,FOC17364QY5,1,39,"8.3.4.2.A; 06/05/2020
",2020-05-06T02:33:14.000Z,NM-HDV2-2T1/E1,NM-HDV2-2T1/E1
USEB,WS-C3560G-48PS-S,1392915600,FOC1319W1LA,0,39,Model Note:V06,2019-08-06T05:03:48.000Z,WS-C3560G-48PS-S#WS-C3560G-48PS-S ,WS-C3560G-48PS-S
USEB,CISCO891-K9,1392915600,FHK1451756W,0,39,Model Note:V01,2019-08-06T05:03:48.000Z,CISCO891-K9#CISCO891-K9 ,CISCO891-K9
USEB,UC560-BRI-K9,1392915600,FHK1439F2FC,0,39,Model Note:V01,2019-08-06T05:03:48.000Z,UC560-BRI-K9#UC560-BRI-K9 ,UC560-BRI-K9
USEB,WS-X4712-SFP+E,1393174800,CAT1602L0AF,0,39,Model Note:V02,2019-08-06T05:03:48.000Z,WS-X4712-SFP+E#WS-X4712-SFP+E ,WS-X4712-SFP+E
USEB,WS-C3560G-24TS-S,1392915600,FOC1126Y1XP,0,39,Model Note:V03,2019-08-06T05:03:48.000Z,WS-C3560G-24TS-S#WS-C3560G-24TS-S ,WS-C3560G-24TS-S
USEB,WS-C3560-24PS-S,1393261200,FDO1451X1CV,0,39,Model Note:V11,2019-08-06T05:03:48.000Z,WS-C3560-24PS-S#WS-C3560-24PS-S ,WS-C3560-24PS-S
USEB,WS-C3560-24PS-S,1393261200,FDO1442Y213,0,39,Model Note:V11,2019-08-06T05:03:48.000Z,WS-C3560-24PS-S#WS-C3560-24PS-S ,WS-C3560-24PS-S
USEB,WS-C3560-24PS-S,1393261200,FDO1401X0GY,0,39,Model Note:V11,2019-08-06T05:03:48.000Z,WS-C3560-24PS-S#WS-C3560-24PS-S ,WS-C3560-24PS-S
USEB,AIR-CAP3502I-NBULK#AIR-CAP3602I-N-K9,1392915600,FGL1448S469,0,39,osi hardware,2019-08-06T00:37:12.000Z,AIR-CAP3502I-NBULK#AIR-CAP3602I-N-K9,AIR-CAP3502I-NBULK
USEB,AIR-CAP3502I-NBULK#AIR-CAP3602I-N-K9,1392915600,FGL1509S0PP,0,39,osi hardware,2019-08-06T00:37:12.000Z,AIR-CAP3502I-NBULK#AIR-CAP3602I-N-K9,AIR-CAP3502I-NBULK
USEC,ASA5510-AIP10-K9,1393261200,JMX1245L2NU,0,39,"Broken Ejector, side damaged",2019-08-06T01:57:19.000Z,ASA5510-AIP10-K9,ASA5510-AIP10-K9
USEB,WS-F6700-DFC3BXL,1393347600,SAL1319PQ0A,0,39,Model Note:V05,2019-08-06T05:03:48.000Z,WS-F6700-DFC3BXL#WS-F6700-DFC3BXL ,WS-F6700-DFC3BXL
USEB,WS-F6700-DFC3BXL,1393347600,SAL1334WS6D,0,39,Model Note:V05,2019-08-06T05:03:48.000Z,WS-F6700-DFC3BXL#WS-F6700-DFC3BXL ,WS-F6700-DFC3BXL
USEB,WS-F6700-DFC3BXL,1393347600,SAL1334WS55,0,39,Model Note:V05,2019-08-06T05:03:48.000Z,WS-F6700-DFC3BXL#WS-F6700-DFC3BXL ,WS-F6700-DFC3BXL
USEB,WS-F6700-DFC3BXL,1393347600,SAL1319PPYQ,0,39,Model Note:V05,2019-08-06T05:03:48.000Z,WS-F6700-DFC3BXL#WS-F6700-DFC3BXL ,WS-F6700-DFC3BXL
USEB,WS-F6700-DFC3BXL,1393347600,SAL1319PPY6,0,39,Model Note:V05,2019-08-06T05:03:48.000Z,WS-F6700-DFC3BXL#WS-F6700-DFC3BXL ,WS-F6700-DFC3BXL
USEB,ME-3400EG-2CS-A,1393434000,FOC1615V0ZA,0,39,Model Note:V03,2019-08-06T05:03:48.000Z,ME-3400EG-2CS-A#ME-3400EG-2CS-A ,ME-3400EG-2CS-A
USEB,ME-3400EG-2CS-A,1393434000,FOC1708V2R4,0,39,Model Note:V03,2019-08-06T05:03:48.000Z,ME-3400EG-2CS-A#ME-3400EG-2CS-A ,ME-3400EG-2CS-A
USEB,ME-3400EG-2CS-A,1393434000,FOC1520V0DB,0,39,Model Note:V03,2019-08-06T05:03:48.000Z,ME-3400EG-2CS-A#ME-3400EG-2CS-A ,ME-3400EG-2CS-A
USEB,ME-3400G-2CS-A,1393434000,FOC1421W57V,0,39,Model Note:V03,2019-08-06T05:03:48.000Z,ME-3400G-2CS-A#ME-3400G-2CS-A ,ME-3400G-2CS-A
USEB,ME-3400G-2CS-A,1393434000,FOC1405X4F2,0,39,Model Note:V03,2019-08-06T05:03:48.000Z,ME-3400G-2CS-A#ME-3400G-2CS-A ,ME-3400G-2CS-A
USEB,WS-C3750X-48PF-S,1393434000,FDO1616P147,0,39,Model Note:V02,2019-08-06T05:03:48.000Z,WS-C3750X-48PF-S#WS-C3750X-48PF-S ,WS-C3750X-48PF-S
USEB,HWIC-3G-HSPA,1393434000,FOC14354FN3,0,39,Model Note:V02,2019-08-06T05:03:48.000Z,HWIC-3G-HSPA#HWIC-3G-HSPA ,HWIC-3G-HSPA
USEB,HWIC-3G-HSPA,1393434000,FOC13460MT1,0,39,Model Note:V02,2019-08-06T05:03:48.000Z,HWIC-3G-HSPA#HWIC-3G-HSPA ,HWIC-3G-HSPA
USEB,HWIC-3G-HSPA,1393434000,FOC14342GHT,0,39,Model Note:V02,2019-08-06T05:03:48.000Z,HWIC-3G-HSPA#HWIC-3G-HSPA ,HWIC-3G-HSPA
USEB,HWIC-3G-HSPA,1393434000,FOC13391ZD5,0,39,Model Note:V02,2019-08-06T05:03:48.000Z,HWIC-3G-HSPA#HWIC-3G-HSPA ,HWIC-3G-HSPA
USEC,HWIC-3G-HSPA,1393434000,FOC13400EED,1,39,"WH by Long,",2019-08-06T00:06:21.000Z,HWIC-3G-HSPA,HWIC-3G-HSPA
USEB,EHWIC-3G-HSPA-U#HWIC-3G-HSPA ,1393434000,FOC171047XT,0,39,Model Note:V02,2019-08-06T00:37:12.000Z,EHWIC-3G-HSPA-U#HWIC-3G-HSPA ,EHWIC-3G-HSPA-U
USEB,HWIC-3G-HSPA,1393434000,FOC14214WYE,0,39,Model Note:V02,2019-08-06T05:03:48.000Z,HWIC-3G-HSPA#HWIC-3G-HSPA ,HWIC-3G-HSPA
USEB,HWIC-3G-GSM,1393434000,FOC12214YWF,0,39,Model Note:V01,2019-08-06T05:03:48.000Z,HWIC-3G-GSM#HWIC-3G-GSM ,HWIC-3G-GSM
USEB,CISCO1941-SEC/K9#CISCO1941/K9 ,1393434000,FGL170922JS,0,39,Model Note:V05,2019-08-06T00:37:12.000Z,CISCO1941-SEC/K9#CISCO1941/K9 ,CISCO1941-SEC/K9
USEB,WS-C2960S-48FPS-L,1393434000,FOC1650X2RY,0,39,Model Note:V03,2019-08-06T05:03:48.000Z,WS-C2960S-48FPS-L#WS-C2960S-48FPS-L ,WS-C2960S-48FPS-L
USEB,WS-C3560G-24TS-S#WS-C3750G-48PS-S,1394125200,FOC0924U2U5,0,39,osi hardware,2019-08-06T00:37:12.000Z,WS-C3560G-24TS-S#WS-C3750G-48PS-S,WS-C3560G-24TS-S
USEB,WS-C2960G-48TC-L,1394125200,FOC1152X4CE,0,39,Model Note:V02,2019-08-06T05:03:48.000Z,WS-C2960G-48TC-L#WS-C2960G-48TC-L ,WS-C2960G-48TC-L
USEB,WS-C3750G-24T-S,1394125200,CAT1123ZGEE,0,39,Model Note:V05,2019-08-06T05:03:48.000Z,WS-C3750G-24T-S#WS-C3750G-24T-S ,WS-C3750G-24T-S
USEB,7600-ES+20G3CXL,1394125200,JAE141703M4,0,39,Model Note:V08,2019-08-06T01:57:19.000Z,7600-ES+20G3CXL,7600-ES+20G3CXL
USEB,VS-S720-10G#VS-S720-10G-3C,1394125200,SAL1335X8LS,0,39,osi hardware,2019-08-06T00:37:12.000Z,VS-S720-10G#VS-S720-10G-3C,VS-S720-10G
USEC,HWIC-1ADSL,1394125200,FOC1618605R,0,39,Broken Component,2019-08-06T01:57:19.000Z,HWIC-1ADSL,HWIC-1ADSL
USEB,EHWIC-1GE-SFP-CU,1394125200,FOC17307FNS,0,39,Model Note:V01,2019-08-06T05:03:48.000Z,EHWIC-1GE-SFP-CU#EHWIC-1GE-SFP-CU ,EHWIC-1GE-SFP-CU
USEB,HWIC-3G-HSPA,1394125200,FOC14262KEW,0,39,Model Note:V02,2019-08-06T05:03:48.000Z,HWIC-3G-HSPA#HWIC-3G-HSPA ,HWIC-3G-HSPA
USEB,HWIC-3G-HSPA,1394125200,FOC14342FKW,0,39,Model Note:V02,2019-08-06T05:03:48.000Z,HWIC-3G-HSPA#HWIC-3G-HSPA ,HWIC-3G-HSPA
USEB,ASA5510-SEC-BUN-K9,1394125200,JMX1435L0YH,0,39,osi hardware,2019-08-06T01:57:19.000Z,ASA5510-SEC-BUN-K9,ASA5510-SEC-BUN-K9
USEC,VIC2-2FXS,1394125200,FOC12105PWD,0,39,"Broken Component, For Local only",2019-08-06T00:06:28.000Z,VIC2-2FXS,VIC2-2FXS
USEC,VIC2-2FXS,1394125200,FOC092116X9,0,39,"Broken Component, For Local only",2019-08-06T00:06:28.000Z,VIC2-2FXS,VIC2-2FXS
USEB,VIC2-2FXS,1394125200,FOC092242W7,1,39,"WH by Long,",2019-08-06T00:06:28.000Z,VIC2-2FXS,VIC2-2FXS
USEB,WS-X6708-10GE,1394384400,SAL1130VZBF,0,39,Model Note:V03,2019-08-06T05:03:48.000Z,WS-X6708-10GE#WS-X6708-10GE ,WS-X6708-10GE
USEB,X2-10GB-LX4,1394384400,HCT11290999,1,39,"V03, WH",2019-08-06T05:03:48.000Z,X2-10GB-LX4#X2-10GB-LX4 ,X2-10GB-LX4
USEB,X2-10GB-LX4,1394384400,HCT11270258,1,39,"V03, WH",2019-08-06T05:03:48.000Z,X2-10GB-LX4#X2-10GB-LX4 ,X2-10GB-LX4
USEB,X2-10GB-LX4,1394384400,HCT11290780,1,39,"V03, WH",2019-08-06T05:03:48.000Z,X2-10GB-LX4#X2-10GB-LX4 ,X2-10GB-LX4
USEB,X2-10GB-LX4,1394384400,HCT11291007,1,39,"V03, WH",2019-08-06T05:03:48.000Z,X2-10GB-LX4#X2-10GB-LX4 ,X2-10GB-LX4
USEB,X2-10GB-LX4,1394384400,HCT11290994,1,39,"V03, WH",2019-08-06T05:03:48.000Z,X2-10GB-LX4#X2-10GB-LX4 ,X2-10GB-LX4
USEB,WS-X6708-10G-3C#WS-X6708-10GE,1394384400,SAL17236M21,0,39,osi hardware,2019-08-06T00:37:12.000Z,WS-X6708-10G-3C#WS-X6708-10GE,WS-X6708-10G-3C
USEB,HWIC-3G-HSPA,1394384400,FOC15297QWH,0,39,Model Note:V02,2019-08-06T05:03:48.000Z,HWIC-3G-HSPA#HWIC-3G-HSPA ,HWIC-3G-HSPA
USEB,CISCO877W-G-A-M-K9#CISCO877W-M,1394384400,FHK143070LC,0,39,osi hardware,2019-08-06T00:37:12.000Z,CISCO877W-G-A-M-K9#CISCO877W-M,CISCO877W-G-A-M-K9
USEB,WS-C3750G-48TS-S,1394384400,FOC1347Z503,0,39,Model Note:V04,2019-08-06T05:03:48.000Z,WS-C3750G-48TS-S#WS-C3750G-48TS-S ,WS-C3750G-48TS-S
USEB,WS-C3750G-48TS-S,1394384400,FOC1148Y1LL,0,39,Model Note:V04,2019-08-06T05:03:48.000Z,WS-C3750G-48TS-S#WS-C3750G-48TS-S ,WS-C3750G-48TS-S
USEB,WS-C3750G-48TS-S,1394384400,FOC1348Z5P3,0,39,Model Note:V04,2019-08-06T05:03:48.000Z,WS-C3750G-48TS-S#WS-C3750G-48TS-S ,WS-C3750G-48TS-S
USEB,WS-C3750G-48TS-S,1394384400,FOC1345Z48C,0,39,Model Note:V04,2019-08-06T05:03:48.000Z,WS-C3750G-48TS-S#WS-C3750G-48TS-S ,WS-C3750G-48TS-S
NIB,VIC2-2BRI-NT/TE,1394557200,FOC13384GZL,0,39,"WH,",2019-08-06T00:06:29.000Z,VIC2-2BRI-NT/TE,VIC2-2BRI-NT/TE
USEB,HWIC-1GE-SFP,1394730000,FOC100723T1,0,39,"WH by Trung, New able",2019-08-06T00:06:29.000Z,HWIC-1GE-SFP,HWIC-1GE-SFP
USEB,CISCO881-SEC-K9,1394730000,FGL152920S0,0,39,Model Note:V01,2019-08-06T05:03:49.000Z,CISCO881-SEC-K9#CISCO881-SEC-K9 ,CISCO881-SEC-K9
NIB,NM-HDV2-2T1/E1=,1394989200,FOC17252K7W,1,39,"8.3.4.2.A; 06/05/2020
",2020-05-06T02:33:14.000Z,NM-HDV2-2T1/E1,NM-HDV2-2T1/E1
USEB,X2-10GB-LX4,1394989200,HCT11290987,1,39,osi hardware,2019-08-06T01:57:19.000Z,X2-10GB-LX4,X2-10GB-LX4
USEB,X2-10GB-LX4,1394989200,HCT12340549,1,39,osi hardware,2019-08-06T01:57:19.000Z,X2-10GB-LX4,X2-10GB-LX4
USEB,C3KX-NM-1G,1394989200,FDO17130QX2,0,39,Model Note:V01,2019-08-06T05:03:49.000Z,C3KX-NM-1G#C3KX-NM-1G ,C3KX-NM-1G
USEC,CISCO1801,1395162000,FHK1137F3VE,0,39,"No Face, Broken Ejector",2019-08-06T00:06:29.000Z,CISCO1801,CISCO1801
USEB,WS-C2960S-24PS-L,1395248400,FOC1503X10M,0,39,Model Note:V02,2019-08-06T05:03:49.000Z,WS-C2960S-24PS-L#WS-C2960S-24PS-L ,WS-C2960S-24PS-L
NIB,AIR-CAP3602I-NBULK#AIR-CAP3602I-NK910,1395334800,FGL1631W0XG,0,39,NIB in Pack of 10,2019-08-06T00:37:12.000Z,AIR-CAP3602I-NBULK#AIR-CAP3602I-NK910,AIR-CAP3602I-NBULK
NIB,AIR-CAP3602I-NBULK#AIR-CAP3602I-NK910,1395334800,FGL1631W0XE,0,39,NIB in Pack of 10,2019-08-06T00:37:12.000Z,AIR-CAP3602I-NBULK#AIR-CAP3602I-NK910,AIR-CAP3602I-NBULK
NIB,AIR-CAP3602I-NBULK#AIR-CAP3602I-NK910,1395334800,FGL1631W0XB,0,39,NIB in Pack of 10,2019-08-06T00:37:12.000Z,AIR-CAP3602I-NBULK#AIR-CAP3602I-NK910,AIR-CAP3602I-NBULK
NIB,AIR-CAP3602I-NBULK#AIR-CAP3602I-NK910,1395334800,FGL1631W0X9,0,39,NIB in Pack of 10,2019-08-06T00:37:12.000Z,AIR-CAP3602I-NBULK#AIR-CAP3602I-NK910,AIR-CAP3602I-NBULK
NIB,AIR-CAP3602I-NBULK#AIR-CAP3602I-NK910,1395334800,FGL1631W0X8,0,39,NIB in Pack of 10,2019-08-06T00:37:12.000Z,AIR-CAP3602I-NBULK#AIR-CAP3602I-NK910,AIR-CAP3602I-NBULK
NIB,AIR-CAP3602I-NBULK#AIR-CAP3602I-NK910,1395334800,FGL1631W0XN,0,39,NIB in Pack of 10,2019-08-06T00:37:12.000Z,AIR-CAP3602I-NBULK#AIR-CAP3602I-NK910,AIR-CAP3602I-NBULK
NIB,AIR-CAP3602I-NBULK#AIR-CAP3602I-NK910,1395334800,FGL1631W0XC,0,39,NIB in Pack of 10,2019-08-06T00:37:12.000Z,AIR-CAP3602I-NBULK#AIR-CAP3602I-NK910,AIR-CAP3602I-NBULK
NIB,AIR-CAP3602I-NBULK#AIR-CAP3602I-NK910,1395334800,FGL1631W0XD,0,39,NIB in Pack of 10,2019-08-06T00:37:12.000Z,AIR-CAP3602I-NBULK#AIR-CAP3602I-NK910,AIR-CAP3602I-NBULK
NIB,AIR-CAP3602I-NBULK#AIR-CAP3602I-NK910,1395334800,FGL1631W0X6,0,39,NIB in Pack of 10,2019-08-06T00:37:12.000Z,AIR-CAP3602I-NBULK#AIR-CAP3602I-NK910,AIR-CAP3602I-NBULK
NIB,AIR-CAP3602I-NBULK#AIR-CAP3602I-NK910,1395334800,FGL1631W0X5,0,39,NIB in Pack of 10,2019-08-06T00:37:12.000Z,AIR-CAP3602I-NBULK#AIR-CAP3602I-NK910,AIR-CAP3602I-NBULK
NIB,AIR-CAP3602I-NBULK#AIR-CAP3602I-NK910,1395334800,FGL1631W180,0,39,NIB in Pack of 10,2019-08-06T00:37:12.000Z,AIR-CAP3602I-NBULK#AIR-CAP3602I-NK910,AIR-CAP3602I-NBULK
NIB,AIR-CAP3602I-NBULK#AIR-CAP3602I-NK910,1395334800,FGL1631W182,0,39,NIB in Pack of 10,2019-08-06T01:57:19.000Z,AIR-CAP3602I-NBULK#AIR-CAP3602I-NK910,AIR-CAP3602I-NBULK
NIB,AIR-CAP3602I-NBULK#AIR-CAP3602I-NK910,1395334800,FGL1631W17Y,0,39,NIB in Pack of 10,2019-08-06T00:37:12.000Z,AIR-CAP3602I-NBULK#AIR-CAP3602I-NK910,AIR-CAP3602I-NBULK
NIB,AIR-CAP3602I-NBULK#AIR-CAP3602I-NK910,1395334800,FGL1631W17X,0,39,NIB in Pack of 10,2019-08-06T00:37:12.000Z,AIR-CAP3602I-NBULK#AIR-CAP3602I-NK910,AIR-CAP3602I-NBULK
NIB,AIR-CAP3602I-NBULK#AIR-CAP3602I-NK910,1395334800,FGL1631W17W,0,39,NIB in Pack of 10,2019-08-06T00:37:12.000Z,AIR-CAP3602I-NBULK#AIR-CAP3602I-NK910,AIR-CAP3602I-NBULK
NIB,AIR-CAP3602I-NBULK#AIR-CAP3602I-NK910,1395334800,FGL1631W17G,0,39,NIB in Pack of 10,2019-08-06T00:37:12.000Z,AIR-CAP3602I-NBULK#AIR-CAP3602I-NK910,AIR-CAP3602I-NBULK
NIB,AIR-CAP3602I-NBULK#AIR-CAP3602I-NK910,1395334800,FGL1631W17D,0,39,NIB in Pack of 10,2019-08-06T00:37:12.000Z,AIR-CAP3602I-NBULK#AIR-CAP3602I-NK910,AIR-CAP3602I-NBULK
NIB,AIR-CAP3602I-NBULK#AIR-CAP3602I-NK910,1395334800,FGL1631W17E,0,39,NIB in Pack of 10,2019-08-06T00:37:12.000Z,AIR-CAP3602I-NBULK#AIR-CAP3602I-NK910,AIR-CAP3602I-NBULK
NIB,AIR-CAP3602I-NBULK#AIR-CAP3602I-NK910,1395334800,FGL1631W17P,0,39,NIB in Pack of 10,2019-08-06T00:37:12.000Z,AIR-CAP3602I-NBULK#AIR-CAP3602I-NK910,AIR-CAP3602I-NBULK
NIB,AIR-CAP3602I-NBULK#AIR-CAP3602I-NK910,1395334800,FGL1631W17U,0,39,NIB in Pack of 10,2019-08-06T00:37:12.000Z,AIR-CAP3602I-NBULK#AIR-CAP3602I-NK910,AIR-CAP3602I-NBULK
NOB,AIR-CAP3602I-NBULK#AIR-CAP3602I-NK910,1395334800,FGL1631W13G,0,39,NOB in Pack of 10,2019-08-06T00:37:12.000Z,AIR-CAP3602I-NBULK#AIR-CAP3602I-NK910,AIR-CAP3602I-NBULK
NOB,AIR-CAP3602I-NBULK#AIR-CAP3602I-NK910,1395334800,FGL1631W13J,0,39,NOB in Pack of 10,2019-08-06T00:37:12.000Z,AIR-CAP3602I-NBULK#AIR-CAP3602I-NK910,AIR-CAP3602I-NBULK
NOB,AIR-CAP3602I-NBULK#AIR-CAP3602I-NK910,1395334800,FGL1631W13Q,0,39,NOB in Pack of 10,2019-08-06T00:37:12.000Z,AIR-CAP3602I-NBULK#AIR-CAP3602I-NK910,AIR-CAP3602I-NBULK
NOB,AIR-CAP3602I-NBULK#AIR-CAP3602I-NK910,1395334800,FGL1631W13M,0,39,NOB in Pack of 10,2019-08-06T00:37:12.000Z,AIR-CAP3602I-NBULK#AIR-CAP3602I-NK910,AIR-CAP3602I-NBULK
NOB,AIR-CAP3602I-NBULK#AIR-CAP3602I-NK910,1395334800,FGL1631W13Y,0,39,NOB in Pack of 10,2019-08-06T00:37:12.000Z,AIR-CAP3602I-NBULK#AIR-CAP3602I-NK910,AIR-CAP3602I-NBULK
NOB,AIR-CAP3602I-NBULK#AIR-CAP3602I-NK910,1395334800,FGL1631W13H,0,39,NOB in Pack of 10,2019-08-06T00:37:12.000Z,AIR-CAP3602I-NBULK#AIR-CAP3602I-NK910,AIR-CAP3602I-NBULK
NOB,AIR-CAP3602I-NBULK#AIR-CAP3602I-NK910,1395334800,FGL1631W13S,0,39,NOB in Pack of 10,2019-08-06T00:37:12.000Z,AIR-CAP3602I-NBULK#AIR-CAP3602I-NK910,AIR-CAP3602I-NBULK
NOB,AIR-CAP3602I-NBULK#AIR-CAP3602I-NK910,1395334800,FGL1631W12W,0,39,NOB in Pack of 10,2019-08-06T00:37:12.000Z,AIR-CAP3602I-NBULK#AIR-CAP3602I-NK910,AIR-CAP3602I-NBULK
NOB,AIR-CAP3602I-NBULK#AIR-CAP3602I-NK910,1395334800,FGL1631W13V,0,39,NOB in Pack of 10,2019-08-06T00:37:12.000Z,AIR-CAP3602I-NBULK#AIR-CAP3602I-NK910,AIR-CAP3602I-NBULK
NOB,AIR-CAP3602I-NBULK#AIR-CAP3602I-NK910,1395334800,FGL1631W13U,0,39,NOB in Pack of 10,2019-08-06T00:37:12.000Z,AIR-CAP3602I-NBULK#AIR-CAP3602I-NK910,AIR-CAP3602I-NBULK
USEB,WS-C2960-24TC-L,1395334800,FOC1148W4EL,0,39,Model Note:V03,2019-08-06T05:03:49.000Z,WS-C2960-24TC-L#WS-C2960-24TC-L ,WS-C2960-24TC-L
USEB,AIR-LAP1142N-N-K9,1395334800,FCW1434S145,0,39,osi hardware,2019-08-06T00:06:30.000Z,AIR-LAP1142N-N-K9,AIR-LAP1142N-N-K9
USEB,CISCO887-K9,1395334800,FGL15042GL8,0,39,Model Note:V01,2019-08-06T05:03:49.000Z,CISCO887-K9#CISCO887-K9 ,CISCO887-K9
USEB,SPA-5X1GE-V2,1395594000,JAE1335HS3M,0,39,Model Note:V02,2019-08-06T05:03:49.000Z,SPA-5X1GE-V2#SPA-5X1GE-V2 ,SPA-5X1GE-V2
USEB,WS-C2960-24TC-L,1395594000,FOC1325W0BZ,0,39,Model Note:V05,2019-08-06T05:03:49.000Z,WS-C2960-24TC-L#WS-C2960-24TC-L ,WS-C2960-24TC-L
USEB,WS-C3750G-48PS-S#WS-C3750G-48PS-E,1395594000,FOC1114Y2DV,0,39,osi hardware,2019-08-06T00:37:12.000Z,WS-C3750G-48PS-S#WS-C3750G-48PS-E,WS-C3750G-48PS-S
USEC,WS-C3750G-24TS-S1U,1395594000,FOC0938U2PH,0,39,Port 5 not stable for local,2019-08-06T00:06:30.000Z,WS-C3750G-24TS-S1U,WS-C3750G-24TS-S1U
USEB,C3KX-PWR-1100WAC,1395680400,LIT144708L1,0,39,Pack379,2019-08-06T05:03:49.000Z,C3KX-PWR-1100WAC#C3KX-PWR-1100WAC ,C3KX-PWR-1100WAC
USEB,ASA5510-SEC-BUN-K9,1395680400,JMX1215L2QW,0,39,osi hardware,2019-08-06T00:06:30.000Z,ASA5510-SEC-BUN-K9,ASA5510-SEC-BUN-K9
USEB,WS-C3750G-48TS-E#WS-C3750G-48TS-E V,1395680400,FCZ1151Y020,0,39,Model Note:V04,2019-08-06T00:37:12.000Z,WS-C3750G-48TS-E#WS-C3750G-48TS-E V,WS-C3750G-48TS-E
USEB,WS-C3560-8PC-S,1395680400,FOC1415W3XY,0,39,Model Note:V03,2019-08-06T05:03:49.000Z,WS-C3560-8PC-S#WS-C3560-8PC-S ,WS-C3560-8PC-S
USEB,WS-C3750G-24PSS-RF#WS-C3750G-24PS-S ,1395853200,FOC1137Y3AB,0,39,Model Note:V06,2019-08-06T00:37:12.000Z,WS-C3750G-24PSS-RF#WS-C3750G-24PS-S ,WS-C3750G-24PSS-RF
USEB,WS-C3560X-24T-L,1395853200,FDO1450K03F,0,39,Model Note:V01,2019-08-06T05:03:49.000Z,WS-C3560X-24T-L#WS-C3560X-24T-L ,WS-C3560X-24T-L
USEC,ASA5510-BUN-K9,1395853200,JMX0946K0LS,0,39,Broken Ejector,2019-08-06T00:06:30.000Z,ASA5510-BUN-K9,ASA5510-BUN-K9
USEB,WS-C3750G-24TS-E1U,1395853200,FOC1306W04X,0,39,Model Note:V03,2019-08-06T05:03:49.000Z,WS-C3750G-24TS-E1U#WS-C3750G-24TS-E1U ,WS-C3750G-24TS-E1U
USEB,WS-C3750G-24TS-E1U,1395853200,FOC1306W04Y,0,39,Model Note:V03,2019-08-06T05:03:49.000Z,WS-C3750G-24TS-E1U#WS-C3750G-24TS-E1U ,WS-C3750G-24TS-E1U
USEB,WS-C2960S-24TS-L,1395939600,FOC1531W3K5,0,39,Model Note:V02,2019-08-06T05:03:49.000Z,WS-C2960S-24TS-L#WS-C2960S-24TS-L ,WS-C2960S-24TS-L
USEB,WS-C3750E-48PD-S,1395939600,FDO1544Y15R,0,39,Model Note:V05,2019-08-06T05:03:49.000Z,WS-C3750E-48PD-S#WS-C3750E-48PD-S ,WS-C3750E-48PD-S
USEC,HWIC-1ADSL,1395939600,FOC11150VDR,0,39,Broken Component,2019-08-06T00:06:30.000Z,HWIC-1ADSL,HWIC-1ADSL
USEB,ASA5510-AIP10-K8#ASA5510-AIP10-K9,1386867600,JMX1152L1M3,0,39,osi hardware,2019-08-06T00:06:36.000Z,ASA5510-AIP10-K8#ASA5510-AIP10-K9,ASA5510-AIP10-K8
USEB,ASA-SSM-AIP-10-K9#ASA-SSM-10,1386867600,JAF1208ALMP,0,39,osi hardware,2019-08-06T00:06:36.000Z,ASA-SSM-AIP-10-K9#ASA-SSM-10,ASA-SSM-AIP-10-K9
USEB,AIR-CT5508-50-K9#AIR-CT5508-K9,1386954000,FCW1335L04D,0,39,osi hardware,2019-08-06T00:06:37.000Z,AIR-CT5508-50-K9#AIR-CT5508-K9,AIR-CT5508-50-K9
USEC,HWIC-1ADSL,1395939600,FOC10454JKX,0,39,Broken Component,2019-08-06T00:06:44.000Z,HWIC-1ADSL,HWIC-1ADSL
USEC,HWIC-1ADSL,1395939600,FOC140948L7,0,39,Broken Component,2019-08-06T00:06:44.000Z,HWIC-1ADSL,HWIC-1ADSL
USEC,HWIC-1ADSL,1395939600,FOC10454J71,0,39,Broken Component,2019-08-06T00:06:44.000Z,HWIC-1ADSL,HWIC-1ADSL
USEC,HWIC-1ADSL,1395939600,FOC11064PCC,0,39,Broken Component,2019-08-06T00:06:44.000Z,HWIC-1ADSL,HWIC-1ADSL
USEC,HWIC-1ADSL,1395939600,FOC11064P3V,0,39,Broken Component,2019-08-06T00:06:44.000Z,HWIC-1ADSL,HWIC-1ADSL
USEC,HWIC-1ADSL,1395939600,FOC11064PUM,0,39,Broken Component,2019-08-06T00:06:45.000Z,HWIC-1ADSL,HWIC-1ADSL
USEB,UC560-BRI-K9,1396198800,FHK1406F07E,0,39,Model Note:V01,2019-08-06T05:03:49.000Z,UC560-BRI-K9#UC560-BRI-K9 ,UC560-BRI-K9
USEB,C2960S-STACK,1396198800,FOC17161FQG,0,39,Model Note:V02,2019-08-06T05:03:49.000Z,C2960S-STACK#C2960S-STACK ,C2960S-STACK
USEB,C2960S-STACK,1396198800,FOC17161EKT,0,39,Model Note:V02,2019-08-06T05:03:49.000Z,C2960S-STACK#C2960S-STACK ,C2960S-STACK
USEC,WS-C3750X-48PF-S,1396198800,FDO1550P16H,0,39,No SN label,2019-08-06T05:03:49.000Z,WS-C3750X-48PF-S#WS-C3750X-48PF-S ,WS-C3750X-48PF-S
USEB,WS-C2960-24PC-L,1396285200,FCQ1521Y4T6,0,39,Model Note:V05,2019-08-06T05:03:49.000Z,WS-C2960-24PC-L#WS-C2960-24PC-L ,WS-C2960-24PC-L
USEB,ASA5520-BUN-K9,1396371600,JMX1618X0L4,0,39,osi hardware,2019-08-06T01:57:19.000Z,ASA5520-BUN-K9,ASA5520-BUN-K9
USEB,ASA5510-SEC-BUN-K9,1396371600,JMX1424L0DC,0,39,osi hardware,2019-08-06T01:57:19.000Z,ASA5510-SEC-BUN-K9,ASA5510-SEC-BUN-K9
USEB,ASA5510-SEC-BUN-K9,1396371600,JMX1424L0D8,0,39,osi hardware,2019-08-06T01:57:19.000Z,ASA5510-SEC-BUN-K9,ASA5510-SEC-BUN-K9
USEB,HWIC-1FE,1396371600,FOC14050LZZ,0,39,Model Note:V01,2019-08-06T05:03:49.000Z,HWIC-1FE#HWIC-1FE ,HWIC-1FE
USEB,VS-S720-10G,1396371600,SAL13431RVH,0,39,Model Note:V04,2019-08-06T05:03:49.000Z,VS-S720-10G#VS-S720-10G ,VS-S720-10G
USEB,WS-C3750G-48PS-S,1396371600,FOC1240W3ZC,0,39,Model Note:V05,2019-08-06T05:03:49.000Z,WS-C3750G-48PS-S#WS-C3750G-48PS-S ,WS-C3750G-48PS-S
USEB,WS-C3750X-48PF-S,1396371600,FDO1624R0Y8,0,39,Model Note:V02,2019-08-06T05:03:49.000Z,WS-C3750X-48PF-S#WS-C3750X-48PF-S ,WS-C3750X-48PF-S
USEB,AIR-CAP3502I-NBULK#AIR-CAP3502I-N-K9,1396458000,FGL1542S2L3,0,39,osi hardware,2019-08-06T00:37:12.000Z,AIR-CAP3502I-NBULK#AIR-CAP3502I-N-K9,AIR-CAP3502I-NBULK
USEB,AIR-LAP1142-NBULK#AIR-LAP1142N-N-K9,1396458000,FCW1349S0M9,0,39,osi hardware,2019-08-06T00:37:12.000Z,AIR-LAP1142-NBULK#AIR-LAP1142N-N-K9,AIR-LAP1142-NBULK
USEB,CISCO1921/K9,1396544400,FGL1510226H,0,39,Model Note:V01,2019-08-06T05:03:49.000Z,CISCO1921/K9#CISCO1921/K9 ,CISCO1921/K9
USEB,AIR-AP1131AG-N-K9#AIR-LAP1131AG-N-K9,1396803600,FHK1051C0R7,0,39,osi hardware,2019-08-06T00:37:12.000Z,AIR-AP1131AG-N-K9#AIR-LAP1131AG-N-K9,AIR-AP1131AG-N-K9
USEB,AIR-AP1131AG-N-K9#AIR-LAP1131AG-N-K9,1396803600,FHK1051C0QJ,0,39,osi hardware,2019-08-06T00:37:12.000Z,AIR-AP1131AG-N-K9#AIR-LAP1131AG-N-K9,AIR-AP1131AG-N-K9
USEB,AIR-AP1131AG-N-K9#AIR-LAP1131AG-N-K9,1396803600,FHK1051C0R0,0,39,osi hardware,2019-08-06T00:37:12.000Z,AIR-AP1131AG-N-K9#AIR-LAP1131AG-N-K9,AIR-AP1131AG-N-K9
USEB,WS-C3750-48TS-S,1396544400,CAT0920Z0X2,0,39,osi hardware,2019-08-06T01:57:19.000Z,WS-C3750-48TS-S,WS-C3750-48TS-S
USEC,HWIC-1FE,1396890000,FOC14251AXR,0,39,"Broken Component,",2019-08-06T05:03:49.000Z,HWIC-1FE#HWIC-1FE ,HWIC-1FE
USEB,AIR-CAP3502I-NBULK#AIR-CAP3502I-N-K9,1396890000,FGL1542S2KY,0,39,osi hardware,2019-08-06T00:37:12.000Z,AIR-CAP3502I-NBULK#AIR-CAP3502I-N-K9,AIR-CAP3502I-NBULK
USEB,CISCO891-K9,1396890000,FGL163126LU,0,39,Model Note:V02,2019-08-06T05:03:49.000Z,CISCO891-K9#CISCO891-K9 ,CISCO891-K9
USEB,CISCO881-SEC-K9,1396890000,FHK145076QZ,0,39,Model Note:V01,2019-08-06T05:03:49.000Z,CISCO881-SEC-K9#CISCO881-SEC-K9 ,CISCO881-SEC-K9
USEB,WS-C3560-48PS-S,1396890000,FDO1308X21N,0,39,Model Note:V05,2019-08-06T05:03:49.000Z,WS-C3560-48PS-S#WS-C3560-48PS-S ,WS-C3560-48PS-S
USEB,WS-C3560-48PS-S,1396890000,FDO1308X21V,0,39,Model Note:V05,2019-08-06T05:03:49.000Z,WS-C3560-48PS-S#WS-C3560-48PS-S ,WS-C3560-48PS-S
USEB,WS-C3560-48PS-S,1396890000,FDO1308X1Y6,0,39,Model Note:V05,2019-08-06T05:03:49.000Z,WS-C3560-48PS-S#WS-C3560-48PS-S ,WS-C3560-48PS-S
USEB,WS-C3560-48PS-S,1396890000,FDO1308X20J,1,39,"8.1.1.1.A; 28/08/2019
",2019-08-28T01:58:11.000Z,WS-C3560-48PS-S#WS-C3560-48PS-S ,WS-C3560-48PS-S
USEB,WS-C3560-48PS-S,1396890000,FDO1308X1Y4,0,39,Dead,2019-08-06T00:06:46.000Z,WS-C3560-48PS-S,WS-C3560-48PS-S
USEB,WS-C3560-48PS-S,1396890000,FDO1308X1Y7,0,39,Model Note:V05,2019-08-06T05:03:49.000Z,WS-C3560-48PS-S#WS-C3560-48PS-S ,WS-C3560-48PS-S
USEB,WS-C3560-48PS-S,1396890000,FDO1308X1YB,0,39,Model Note:V05,2019-08-06T05:03:49.000Z,WS-C3560-48PS-S#WS-C3560-48PS-S ,WS-C3560-48PS-S
USEB,WS-C3560-48PS-S,1396890000,FDO1308X20N,0,39,Model Note:V05,2019-08-06T05:03:49.000Z,WS-C3560-48PS-S#WS-C3560-48PS-S ,WS-C3560-48PS-S
USEB,WS-C3560-48PS-S,1396890000,FDO1313Y03G,0,39,Model Note:V05,2019-08-06T05:03:49.000Z,WS-C3560-48PS-S#WS-C3560-48PS-S ,WS-C3560-48PS-S
USEB,C3825-VSEC-CCME/K9,1396890000,FTX1133A34V,0,39,osi hardware,2019-08-06T01:57:19.000Z,C3825-VSEC-CCME/K9,C3825-VSEC-CCME/K9
USEB,CISCO3825-CCME/K9,1396890000,FTX1039A0A9,0,39,osi hardware,2019-08-06T01:57:19.000Z,CISCO3825-CCME/K9,CISCO3825-CCME/K9
USEB,CISCO2821-HSEC/K9#CISCO2821,1396890000,FHK1110F0MV,0,39,Ebay ID:  it_suppliers_australia,2019-08-06T01:57:19.000Z,CISCO2821-HSEC/K9#CISCO2821,CISCO2821-HSEC/K9
USEB,VIC2-2BRI-NT/TE,1396890000,FOC10170LRL,0,39,Ebay ID:  it_suppliers_australia,2019-08-06T01:57:19.000Z,VIC2-2BRI-NT/TE,VIC2-2BRI-NT/TE
USEB,WIC-1T,1396890000,17182018,0,39,Ebay ID:  it_suppliers_australia,2019-08-06T01:57:19.000Z,WIC-1T,WIC-1T
USEB,NM-CUE,1396890000,FOC110755XV,0,39,Ebay ID:  it_suppliers_australia,2019-08-06T01:57:19.000Z,NM-CUE,NM-CUE
USEB,HWIC-3G-HSPA,1396890000,FOC16316ZEW,0,39,Model Note:V02,2019-08-06T05:03:49.000Z,HWIC-3G-HSPA#HWIC-3G-HSPA ,HWIC-3G-HSPA
USEB,WS-C3560G-24TS-S,1396976400,FOC0917U0EQ,0,39,Model Note:V01,2019-08-06T05:03:49.000Z,WS-C3560G-24TS-S#WS-C3560G-24TS-S ,WS-C3560G-24TS-S
USEC,WS-C3750G-24PS-E,1396976400,FOC1338W3UP,0,39,"Port 17 Faulty, Port 21 Unstable",2019-08-06T00:06:46.000Z,WS-C3750G-24PS-E,WS-C3750G-24PS-E
USEB,ME-3400EG-2CS-A,1397062800,FOC1641V2E8,0,39,Model Note:V03,2019-08-06T05:03:49.000Z,ME-3400EG-2CS-A#ME-3400EG-2CS-A ,ME-3400EG-2CS-A
USEB,ME-3400EG-2CS-A,1397062800,FOC1612V1SC,0,39,Model Note:V03,2019-08-06T05:03:49.000Z,ME-3400EG-2CS-A#ME-3400EG-2CS-A ,ME-3400EG-2CS-A
USEB,ME-3400EG-2CS-A,1397062800,FOC1545X00P,0,39,Model Note:V03,2019-08-06T05:03:49.000Z,ME-3400EG-2CS-A#ME-3400EG-2CS-A ,ME-3400EG-2CS-A
NIB,ME-3400EG-12CS-M,1397062800,FOC1713Z22K,0,39,"WH by Long,",2019-08-06T01:57:19.000Z,ME-3400EG-12CS-M,ME-3400EG-12CS-M
USEC,WS-C3750G-24TS-S1U,1397062800,FOC1203Y327,0,39,RMA NHR; Stackports stay down when stacking cables is plugged in,2019-08-06T00:06:46.000Z,WS-C3750G-24TS-S1U,WS-C3750G-24TS-S1U
USEB,WS-C3750G-24TS-S,1397062800,CAT0902K1KT,0,39,Repaired for local only,2019-08-06T00:06:47.000Z,WS-C3750G-24TS-S,WS-C3750G-24TS-S
USEB,ASA5510-BUN-K9,1397062800,JMX1025K0D2,0,39,Repaired for local only,2019-08-06T01:57:19.000Z,ASA5510-BUN-K9,ASA5510-BUN-K9
USEC,ASA5510-BUN-K9,1397062800,JMX1048K12W,0,39,"Repaired for local only, No Face and Ejector",2019-08-06T01:57:19.000Z,ASA5510-BUN-K9,ASA5510-BUN-K9
USEC,WS-C3560G-24PS-S,1397062800,FOC1241W2RU,0,39,"Repaired for local only,Broken Face",2019-08-06T05:03:49.000Z,WS-C3560G-24PS-S#WS-C3560G-24PS-S ,WS-C3560G-24PS-S
USEB,WS-C3560CG-8PC-S,1397062800,FOC1516W5XB,0,39,Model Note:V01,2019-08-06T05:03:49.000Z,WS-C3560CG-8PC-S#WS-C3560CG-8PC-S ,WS-C3560CG-8PC-S
USEB,CISCO1801W-AG-B/K9#CISCO1801W,1397149200,FHK130423W5,0,39,osi hardware,2019-08-06T00:37:18.000Z,CISCO1801W-AG-B/K9#CISCO1801W,CISCO1801W-AG-B/K9
USEB,SPA-5X1GE-V2,1397408400,JAE14070SGW,0,39,Model Note:V02,2019-08-06T05:03:49.000Z,SPA-5X1GE-V2#SPA-5X1GE-V2 ,SPA-5X1GE-V2
USEB,SPA-5X1GE-V2,1397408400,JAE1427019J,0,39,Model Note:V02,2019-08-06T05:03:49.000Z,SPA-5X1GE-V2#SPA-5X1GE-V2 ,SPA-5X1GE-V2
USEB,WS-C3750G-24PS-S,1397408400,FOC1507V3PB,0,39,Model Note:V08,2019-08-06T05:03:49.000Z,WS-C3750G-24PS-S#WS-C3750G-24PS-S ,WS-C3750G-24PS-S
USEB,WS-C3750G-24TS-S1U,1397408400,FOC1409Z01W,0,39,Model Note:V03,2019-08-06T05:03:49.000Z,WS-C3750G-24TS-S1U#WS-C3750G-24TS-S1U ,WS-C3750G-24TS-S1U
USEB,AIR-LAP1142N-N-K9#WS-C3560G-24TS-S ,1397408400,FGL1540S179,0,39,Model Note:V03,2019-08-06T01:57:19.000Z,AIR-LAP1142N-N-K9#WS-C3560G-24TS-S ,AIR-LAP1142N-N-K9
USEB,AIR-LAP1142N-N-K9#WS-C3560G-24TS-S ,1397408400,FGL1540S172,0,39,Model Note:V03,2019-08-06T01:57:19.000Z,AIR-LAP1142N-N-K9#WS-C3560G-24TS-S ,AIR-LAP1142N-N-K9
USEB,WS-C3560G-24TS-S,1397408400,FOC1145Y2MB,0,39,Model Note:V03,2019-08-06T05:03:49.000Z,WS-C3560G-24TS-S#WS-C3560G-24TS-S ,WS-C3560G-24TS-S
USEB,WS-C3750E-24TD-S,1397408400,FDO1347R0CV,0,39,Model Note:V03,2019-08-06T05:03:49.000Z,WS-C3750E-24TD-S#WS-C3750E-24TD-S ,WS-C3750E-24TD-S
USEB,WS-C3560G-24TS-S,1397408400,FOC1036Z39P,0,39,Model Note:V02,2019-08-06T05:03:49.000Z,WS-C3560G-24TS-S#WS-C3560G-24TS-S ,WS-C3560G-24TS-S
USEB,HWIC-4ESW,1398099600,FOC14425172,0,39,Rusty for local,2019-08-06T00:06:52.000Z,HWIC-4ESW,HWIC-4ESW
USEB,AIR-CAP3502I-NBULK#AIR-CAP3502I-N-K9,1398099600,FGL1448S48Y,0,39,osi hardware,2019-08-06T00:37:18.000Z,AIR-CAP3502I-NBULK#AIR-CAP3502I-N-K9,AIR-CAP3502I-NBULK
USEB,AIR-CAP3502I-NBULK#AIR-CAP3502I-N-K9,1398099600,FGL1448S3ZT,0,39,osi hardware,2019-08-06T00:37:18.000Z,AIR-CAP3502I-NBULK#AIR-CAP3502I-N-K9,AIR-CAP3502I-NBULK
USEB,AIR-CAP3502I-NBULK#AIR-CAP3502I-N-K9,1398099600,FGL1448S4X8,0,39,osi hardware,2019-08-06T00:37:18.000Z,AIR-CAP3502I-NBULK#AIR-CAP3502I-N-K9,AIR-CAP3502I-NBULK
USEB,AIR-CAP3502I-NBULK#AIR-CAP3502I-N-K9,1398099600,FGL1448S4B0,0,39,osi hardware,2019-08-06T00:37:19.000Z,AIR-CAP3502I-NBULK#AIR-CAP3502I-N-K9,AIR-CAP3502I-NBULK
USEB,AIR-CAP3502I-NBULK#AIR-CAP3502I-N-K9,1398099600,FGL1448S49K,0,39,osi hardware,2019-08-06T00:37:19.000Z,AIR-CAP3502I-NBULK#AIR-CAP3502I-N-K9,AIR-CAP3502I-NBULK
USEB,AIR-CAP3502I-NBULK#AIR-CAP3502I-N-K9,1398099600,FGL1448S42P,0,39,osi hardware,2019-08-06T00:37:19.000Z,AIR-CAP3502I-NBULK#AIR-CAP3502I-N-K9,AIR-CAP3502I-NBULK
USEB,AIR-CAP3502I-NBULK#AIR-CAP3502I-N-K9,1398099600,FGL1448S4CX,0,39,osi hardware,2019-08-06T00:37:19.000Z,AIR-CAP3502I-NBULK#AIR-CAP3502I-N-K9,AIR-CAP3502I-NBULK
USEC,ASA5510-SEC-BUN-K9,1398099600,JMX1250L1QF,0,39,Broken Face,2019-08-06T01:57:19.000Z,ASA5510-SEC-BUN-K9,ASA5510-SEC-BUN-K9
USEB,CP-9971-CL-CAM-K9#CP-9971-CL-K9,1398099600,FCH14238BXW,0,39,Model Note:V01,2019-08-06T00:37:19.000Z,CP-9971-CL-CAM-K9#CP-9971-CL-K9,CP-9971-CL-CAM-K9
USEB,CP-9971-CL-CAM-K9#CP-9971-CL-K9,1398099600,FCH14248LMC,0,39,Model Note:V01,2019-08-06T00:37:19.000Z,CP-9971-CL-CAM-K9#CP-9971-CL-K9,CP-9971-CL-CAM-K9
USEB,WS-C3750-24TS-S,1398099600,CAT1042ZJBC,0,39,Model Note:V05,2019-08-06T05:03:49.000Z,WS-C3750-24TS-S#WS-C3750-24TS-S ,WS-C3750-24TS-S
USEB,WS-C3750X-48PF-L,1398099600,FDO1719R1PC,0,39,Model Note:V04,2019-08-06T01:57:19.000Z,WS-C3750X-48PF-L,WS-C3750X-48PF-L
USEB,WS-C2960S-24PD-L,1398099600,FOC1703Y17Y,0,39,Model Note:V02,2019-08-06T05:03:49.000Z,WS-C2960S-24PD-L#WS-C2960S-24PD-L ,WS-C2960S-24PD-L
USEB,C2960S-STACK,1398099600,FOC17120P5T,0,39,Model Note:V02,2019-08-06T05:03:49.000Z,C2960S-STACK#C2960S-STACK ,C2960S-STACK
USEB,WS-C3750V2-24PS-S,1398099600,FDO1535X174,0,39,Model Note:V07,2019-08-06T05:03:49.000Z,WS-C3750V2-24PS-S#WS-C3750V2-24PS-S ,WS-C3750V2-24PS-S
USEB,WS-C2960S-24PD-L,1398099600,FOC1637W2MR,0,39,Model Note:V03,2019-08-06T05:03:49.000Z,WS-C2960S-24PD-L#WS-C2960S-24PD-L ,WS-C2960S-24PD-L
USEB,WS-C3750-48PS-S,1398186000,CAT1017Z275,0,39,Model Note:V05,2019-08-06T05:03:49.000Z,WS-C3750-48PS-S#WS-C3750-48PS-S ,WS-C3750-48PS-S
USEB,ME-3400G-2CS-A,1398186000,FOC1329V2UP,0,39,Model Note:V03,2019-08-06T05:03:49.000Z,ME-3400G-2CS-A#ME-3400G-2CS-A ,ME-3400G-2CS-A
USEB,WS-C2960G-8TC-L,1398186000,FOC1433V2HJ,0,39,Model Note:V02,2019-08-06T05:03:49.000Z,WS-C2960G-8TC-L#WS-C2960G-8TC-L ,WS-C2960G-8TC-L
USEB,WS-C2960G-8TC-L,1398186000,FOC1606Z0ED,0,39,Model Note:V02,2019-08-06T05:03:49.000Z,WS-C2960G-8TC-L#WS-C2960G-8TC-L ,WS-C2960G-8TC-L
USEB,WS-C2960G-8TC-L,1398186000,FOC1501V381,0,39,Model Note:V02,2019-08-06T05:03:49.000Z,WS-C2960G-8TC-L#WS-C2960G-8TC-L ,WS-C2960G-8TC-L
USEB,WS-C2960G-8TC-L,1398186000,FOC1447Y1WN,0,39,Model Note:V02,2019-08-06T05:03:49.000Z,WS-C2960G-8TC-L#WS-C2960G-8TC-L ,WS-C2960G-8TC-L
USEA,VWIC3-1MFT-T1/E1,1398186000,FOC160403ZF,0,39,Newable,2019-08-06T05:03:49.000Z,VWIC3-1MFT-T1/E1#VWIC3-1MFT-T1/E1 ,VWIC3-1MFT-T1/E1
USEA,VWIC3-1MFT-T1/E1,1398186000,FOC160403DQ,0,39,Newable,2019-08-06T05:03:49.000Z,VWIC3-1MFT-T1/E1#VWIC3-1MFT-T1/E1 ,VWIC3-1MFT-T1/E1
USEB,WS-C3560G-24TS-S,1398186000,FOC0930U2FT,0,39,Model Note:V02,2019-08-06T05:03:49.000Z,WS-C3560G-24TS-S#WS-C3560G-24TS-S ,WS-C3560G-24TS-S
USEB,VWIC-2MFT-E1,1398186000,32510520,0,39,"WH by Long,",2019-08-06T01:57:19.000Z,VWIC-2MFT-E1,VWIC-2MFT-E1
USEB,DS-C9124-0-K9#DS-C9124-K9 ,1398186000,JAF14419U75,0,39,Model Note:V04,2019-08-06T01:57:19.000Z,DS-C9124-0-K9#DS-C9124-K9 ,DS-C9124-0-K9
USEB,DS-C9124-0-K9#DS-C9124-K9 ,1398186000,JAF14419UUU,0,39,Model Note:V04,2019-08-06T01:57:19.000Z,DS-C9124-0-K9#DS-C9124-K9 ,DS-C9124-0-K9
USEB,WS-C2960-48TC-S,1398186000,FOC1233U1R0,0,39,Model Note:V01,2019-08-06T05:03:49.000Z,WS-C2960-48TC-S#WS-C2960-48TC-S ,WS-C2960-48TC-S
USEB,WS-C3750G-24T-E,1398186000,FDO1349Y0XC,0,39,Model Note:V08,2019-08-06T05:03:49.000Z,WS-C3750G-24T-E#WS-C3750G-24T-E ,WS-C3750G-24T-E
USEB,WS-C2960-24TT-L,1398186000,FOC1003X3VU,0,39,Model Note:V01,2019-08-06T05:03:49.000Z,WS-C2960-24TT-L#WS-C2960-24TT-L ,WS-C2960-24TT-L
USEB,WS-C2960-24TT-L,1398186000,FOC1003X366,0,39,Model Note:V01,2019-08-06T05:03:49.000Z,WS-C2960-24TT-L#WS-C2960-24TT-L ,WS-C2960-24TT-L
USEB,WS-C2960-24TT-L,1398186000,FOC1003X35Q,0,39,Model Note:V01,2019-08-06T05:03:49.000Z,WS-C2960-24TT-L#WS-C2960-24TT-L ,WS-C2960-24TT-L
USEB,WS-C2960-24TT-L,1398186000,FOC0946X3P5,0,39,Model Note:V01,2019-08-06T05:03:49.000Z,WS-C2960-24TT-L#WS-C2960-24TT-L ,WS-C2960-24TT-L
USEB,WS-C2960-24TT-L,1398186000,FOC1046Z8FC,0,39,Model Note:V01,2019-08-06T05:03:49.000Z,WS-C2960-24TT-L#WS-C2960-24TT-L ,WS-C2960-24TT-L
USEB,WS-C2960-24TT-L,1398186000,FOC1003X3WP,0,39,Model Note:V01,2019-08-06T05:03:49.000Z,WS-C2960-24TT-L#WS-C2960-24TT-L ,WS-C2960-24TT-L
USEB,WS-C2960-24TT-L,1398186000,FOC1003X3W7,0,39,Model Note:V01,2019-08-06T05:03:49.000Z,WS-C2960-24TT-L#WS-C2960-24TT-L ,WS-C2960-24TT-L
USEB,WS-C2960-24TT-L,1398186000,FOC1003X3XQ,0,39,Model Note:V01,2019-08-06T05:03:49.000Z,WS-C2960-24TT-L#WS-C2960-24TT-L ,WS-C2960-24TT-L
USEB,WS-C2960-24TT-L,1398186000,FOC1003X3W8,0,39,Model Note:V01,2019-08-06T05:03:49.000Z,WS-C2960-24TT-L#WS-C2960-24TT-L ,WS-C2960-24TT-L
USEB,WS-C2960-24TT-L,1398186000,FOC1003X390,0,39,Model Note:V01,2019-08-06T05:03:49.000Z,WS-C2960-24TT-L#WS-C2960-24TT-L ,WS-C2960-24TT-L
USEB,WS-C2960-24TT-L,1398186000,FOC1003X3WV,0,39,Model Note:V01,2019-08-06T05:03:49.000Z,WS-C2960-24TT-L#WS-C2960-24TT-L ,WS-C2960-24TT-L
USEB,WS-C2960-24TT-L,1398186000,FOC1003X3VT,0,39,Model Note:V01,2019-08-06T05:03:49.000Z,WS-C2960-24TT-L#WS-C2960-24TT-L ,WS-C2960-24TT-L
USEB,WS-C2960-24TT-L,1398186000,FOC1003X3VW,0,39,Model Note:V01,2019-08-06T05:03:49.000Z,WS-C2960-24TT-L#WS-C2960-24TT-L ,WS-C2960-24TT-L
USEB,WS-C2960-24TT-L,1398186000,FOC1003X3XL,0,39,Model Note:V01,2019-08-06T05:03:49.000Z,WS-C2960-24TT-L#WS-C2960-24TT-L ,WS-C2960-24TT-L
USEB,WS-C2960-24TT-L,1398186000,FOC0947X0CA,0,39,Model Note:V01,2019-08-06T05:03:49.000Z,WS-C2960-24TT-L#WS-C2960-24TT-L ,WS-C2960-24TT-L
USEB,WS-C2960-24TT-L,1398186000,FOC1112X0M6,0,39,Model Note:V01,2019-08-06T05:03:49.000Z,WS-C2960-24TT-L#WS-C2960-24TT-L ,WS-C2960-24TT-L
USEB,WS-C2960-24TT-L,1398186000,FOC1003X35A,0,39,Model Note:V01,2019-08-06T05:03:49.000Z,WS-C2960-24TT-L#WS-C2960-24TT-L ,WS-C2960-24TT-L
USEB,WS-C2960-24TT-L,1398186000,FOC1003X38K,0,39,Model Note:V01,2019-08-06T05:03:49.000Z,WS-C2960-24TT-L#WS-C2960-24TT-L ,WS-C2960-24TT-L
USEB,WS-C2960-24TT-L,1398186000,FOC1012X16R,0,39,Model Note:V01,2019-08-06T05:03:49.000Z,WS-C2960-24TT-L#WS-C2960-24TT-L ,WS-C2960-24TT-L
USEB,WS-C2960-24TT-L,1398186000,FOC1403X5DR,0,39,Model Note:V01,2019-08-06T05:03:49.000Z,WS-C2960-24TT-L#WS-C2960-24TT-L ,WS-C2960-24TT-L
USEB,WS-C2960-24TT-L,1398186000,FOC1003X3WQ,0,39,Model Note:V01,2019-08-06T05:03:49.000Z,WS-C2960-24TT-L#WS-C2960-24TT-L ,WS-C2960-24TT-L
USEB,WS-C2960-24TT-L,1398186000,FOC1003X3W0,0,39,Model Note:V01,2019-08-06T05:03:49.000Z,WS-C2960-24TT-L#WS-C2960-24TT-L ,WS-C2960-24TT-L
USEB,WS-C2960-24TT-L,1398186000,FOC1014X53S,0,39,Model Note:V01,2019-08-06T05:03:49.000Z,WS-C2960-24TT-L#WS-C2960-24TT-L ,WS-C2960-24TT-L
USEB,WS-C2960-24TT-L,1398186000,FOC1003X3VQ,0,39,Model Note:V01,2019-08-06T05:03:49.000Z,WS-C2960-24TT-L#WS-C2960-24TT-L ,WS-C2960-24TT-L
USEB,WS-C2960-24TT-L,1398186000,FOC1046X4GA,0,39,Model Note:V01,2019-08-06T05:03:49.000Z,WS-C2960-24TT-L#WS-C2960-24TT-L ,WS-C2960-24TT-L
